id_berita,judul,kategori,isi,link
1272332,"Aliansi Ibu Indonesia Minta Aparat Setop Represif, Bebaskan PelajarNasional",nasional,"Aliansi Ibu Indonesia mendesak aparat agar membebaskan seluruh pelajar yang masih ditahan dan berhenti melakukan tindakan represif dalam penanganan demonstrasi. Hal itu mereka sampaikan bersama-sama dalam aksi damai di Taman Ismail Marzuki (TIM), Jakarta Pusat, Rabu (10/9) malam. Aksi itu diawali teatrikal menyalakan 1.000 lilin untuk mengenang korban yang meninggal dalam demonstrasi bergelombang yang dilakukan di sejumlah kota di Indonesia, termasuk Jakarta, pada Agustus hingga awal September ini. ADVERTISEMENT SCROLL TO CONTINUE WITH CONTENT Aksi tersebut kemudian dilanjutkan dengan penyampaian orasi hingga pembacaan puisi secara bergantian oleh para peserta. Selain itu para peserta juga menandatangani Seruan Ibu Indonesia.  Perwakilan Aliansi, Nada Arini mengatakan aksi damai itu dilakukan sebagai bentuk keresahan dari kelompok Ibu di Indonesia terhadap situasi yang terjadi saat ini. ""lbu Pertiwi kita tengah berduka. Semua duka itu akibat kebijakan Pemerintah dan DPR yang menguntungkan elite dan memicu ketidakadilan sosial politik,"" ujarnya kepada wartawan. Nada mengatakan pihaknya juga mengutuk keras sikap negara dan para wakil rakyat yang dinilai tidak memperdulikan pelbagai protes dari masyarakat. Alih-alih mendengarkan, kata dia, suara protes itu justru dibalas dengan kekerasan hingga berujung penangkapan para pelajar oleh aparat negara. ""Kami berani karena kami sadar ada nasib dan masa depan anak-anak kami yang dipertaruhkan. Di tengah kekacauan ini, kami para ibu tidak bisa tinggal diam,"" tuturnya.  Dalam kesempatan itu, Aliansi mendesak agar Kepolisian dapat membebaskan seluruh mahasiswa, pelajar ataupun aktivis yang masih ditahan terkait unjuk rasa. Selain itu, mereka juga meminta agar praktik kekerasan dan represif terhadap massa aksi tidak lagi dilakukan. Terlebih kepada pelajar yang melakukan aksi unjuk rasa. Aliansi Ibu Indonesia juga mendorong agar program yang memiliki anggaran jumbo seperti Makan Bergizi Gratis (MBG) untuk ditunda. Mereka mendesak agar anggaran itu dapat dialihkan kepada sektor-sektor yang mendesak seperti pendidikan dan kesehatan. Terakhir mereka juga meminta kepada Presiden RI Prabowo Subianto dan seluruh jajarannya untuk mendengarkan tuntutan dari masyarakat. ""Laksanakan perubahan berbasis penyebab ketidakadilan dan terapkan perubahan struktur sosial, ekonomi, dan politik agar adil dan setara,"" tuturnya. ""Mulai saat ini dan untuk masa depan anak-anak bangsa yang dikandung lbu Pertiwi, hentikanlah kerusakan sendi-sendi politik, hukum dan ekonomi demokrasi Indonesia,""katanya.   Demo bergelombang terjadi di Indonesia pada akhir Agustus lalu, salah satunya dipicu tunjangan perumahan DPR yang fantastis. Tuntutan pun makin berkembang setelah dalam demo 28 Agustus malam, mobil rantis Brimob yang mengamankan unjuk rasa melindas seorang pengemudi ojol, Affan Kurniawan di Jakarta. Aksi demonstrasi pun pecah di sejumlah kota, termasuk kota-kota kecil dari ujung Indonesia barat hingga timur. Pada 8 September lalu, dalam konferensi pers, Wakapolri Komjen Pol Dedi Prasetyo menyatakan jumlah orang yang ditangkap selama demonstrasi dengan tuduhan kericuhan di sejumlah wilayah di Indonesia sejak akhir Agustus 2025 mencapai total 5.444. Kemudian, per tanggal itu, lebih dari 4.800 sudah dipulangkan ke rumah masing-masing. ""Dari 5.444 yang diamankan, 4.800 di antaranya sudah dipulangkan, jadi tinggal 583 yang saat ini yang dalam proses,"" kata Dedi. Dedi menuturkan, ratusan orang yang masih ditahan sedang diperiksa intensif di Jakarta, Bandung, Semarang, Surabaya, Makassar, dan Medan. Para demonstran yang masih ditahan itu sedang menjalani asesmen oleh penyidik. ",https://www.cnnindonesia.com/nasional/20250910213029-20-1272332/aliansi-ibu-indonesia-minta-aparat-setop-represif-bebaskan-pelajar
1272329,Jadwal Pertandingan Pekan Kelima Super League: Banyak Big MatchOlahraga,olahraga,"Pertandingan pekan kelimaSuper League 2025/2026akan menghadirkan laga-laga besar atau big match. Berikut jadwal pertandingannya. Lanjutan kompetisi Super League setelah jeda kalender internasional ini akan dibuka dengan laga Semen Padang versus PSBS Biak, dilanjutkan duel Persita Tangerang menjamu PSM Makassar pada Kamis (11/9). Berikutnya pada Jumat (12/9), ada laga besar antara Persib Bandung kontra Persebaya. Pertandingan ini akan berlangsung di Stadion Gelora Bandung Lautan Api, mulai pukul 15:30 WIB. ADVERTISEMENT SCROLL TO CONTINUE WITH CONTENT  Dua dari empat pemain Persib, Thom Haye dan Eliano Reijnders punya kans debut di Liga Indonesia dalam pertandingan ini. Penampilan keduanya cukup dinanti Bobotoh. Big match ini krusial bagi Maung Bandung karena dituntut bangkit setelah gagal dalam dua laga beruntun. Kemenangan dibutuhkan Persib guna mengatrol posisi mendekati papan atas Super League. Pada akhir pekan, Sabtu (13/9), Arema FC akan menjamu Dewa United di Stadion Kanjuruhan. Tim tamu berhasrat bangkit setelah ditekuk Persija dalam laga kandang.  Yang tak kalah seru adalah duel PSIM kontra Borneo FC, Minggu (14/9). Sejauh ini Borneo belum terkalahkan, sedangkan PSIM tampil mengejutkan. Rapor Borneo bisa tercoreng. Terakhir, ada duel Persija Jakarta kontra Bali United di Jakarta International Stadium (JIS) pada Minggu (14/9) malam. Dari musim-musim sebelumnya, Bali selalu merepotkan Persija. Jadwal Pertandingan Pekan Kelima Super League 2025/2026: Kamis, 11 September 2025 15:30 WIB: Semen Padang vs PSBS19:00 WIB: Persita vs PSM Jumat, 12 September 2025 15:30 WIB: Persik vs Malut15:30 WIB: Persib vs Persebaya19:00 WIB: Madura vs Bhayangkara Sabtu, 13 September 2025 15:30 WIB: Arema vs Dewa United19:00 WIB: Persis vs Persijap Minggu, 14 September 2025 15:30 WIB: PSIM vs Borneo19:00 WIB: Persija vs Bali United  [Gambas:Video CNN] ",https://www.cnnindonesia.com/olahraga/20250910213706-142-1272329/jadwal-pertandingan-pekan-kelima-super-league-banyak-big-match
1272330,01:08VIDEO: Gibran: Reshuffle Sudah Dihitung MatangTV,tv,"Wakil Presiden Gibran Rakabuming menyebut proses bongkar kursi menteri di Kabinet Merah Putih oleh Presiden Prabowo Subianto sebagai hal yang sudah diputuskan secara matang. Hal ini disampaikan Gibran usai menghadiri panen perdana budidaya lobster di Pulau Setokok, Batam, Kepulauan Riau, Rabu siang.",https://www.cnnindonesia.com/tv/20250910215612-404-1272330/video-gibran-reshuffle-sudah-dihitung-matang
1272286,21 Rumah di Batam Rusak Diterjang Puting BeliungNasional,nasional,"Puluhan rumah warga di Kelurahan Tanjung Buntung, Kecamatan Bengkong, KotaBatam, Kepulauan Riau, rusak akibat diterjang anginputing beliungpada Rabu (10/9). Puluhan rumah mengalami rusak berat, sedang dan ringan. Kebanyakan rumah yang rusak di bagian atap, plafon dan dinding. ""Tadi kita data, bersama kelurahan total ada 21 rumah warga yang rusak, baik berat, sedang dan ringan,"" kata Kepala Bidang Pencegahan dan Kesiapsiagaan Mohammad Farhan, BPBD Batam dikonfirmasi Rabu (10/9). ADVERTISEMENT SCROLL TO CONTINUE WITH CONTENT Tidak ada korban jiwa dalam kejadian angin puting beliung ini. Warga yang terdampak telah mengungsi ke rumah keluarga mereka masing-masing. Saat ini BPBD Batam masih mendata kerugian dari kerusakan rumah warga. Farhan mengatakan bantuan berupa makanan dan minuman serta terpal sudah disalurkan.  ""Tidak ada korban jiwa, untuk kerugian masih kita hitung,"" ujarnya. Sementara itu, Ketua RT 02/RW 14 Kelurahan Tanjung Buntung, Zakaria mengatakan fenomena alam angin puting beliung pernah terjadi pada tahun 2023 lalu. Namun kembali terjadi lagi di September 2025. Dia menyebut saat kejadian turun hujan ringan, tiba-tiba ada angin kencang berputar-putar menerbangkan atap rumah warga dari arah timur melewati rumah warga sekitar. ""Kerusakan rumah warga yang parah itu, di rumah ini Blok A 61 ini lumayan parah dia. Plafonnya sampai jebol,"" katanya kepada wartawan, Rabu (10/9).   ",https://www.cnnindonesia.com/nasional/20250910192945-20-1272286/21-rumah-di-batam-rusak-diterjang-puting-beliung
1272279,KPK Segera Tetapkan dan Umumkan Tersangka Kuota Haji dalam Waktu DekatNasional,nasional,"Komisi Pemberantasan Korupsi (KPK) mengungkapkan bakal menetapkan dan mengumumkan tersangka kasus dugaan korupsikuota hajitambahan tahun 2023-2024 dalam waktu dekat. ""Kapan ini ditetapkan tersangkanya? Dalam waktu dekat, pokoknya dalam waktu dekat,"" ujar Pelaksana Tugas Deputi Penindakan dan Eksekusi KPK Asep Guntur Rahayu di kantornya, Jakarta, Rabu (10/9). Dia pun meminta publik untuk bersabar dan terus mengawasi kerja-kerja KPK. ADVERTISEMENT SCROLL TO CONTINUE WITH CONTENT ""Nanti dikabari ya, pasti dilakukan konferensi pers dalam waktu dekat ini,"" imbuhnya. Dalam proses berjalan, KPK sudah memeriksa banyak saksi. Baik dari jajaran Kementerian Agama maupun agen perjalanan atau travel haji. Beberapa di antaranya eks Menteri Agama Yaqut Cholil Qoumas, serta Direktur Jenderal Penyelenggara Haji dan Umrah (PHU) Kementerian Agama Hilman Latief. Kemudian Ishfah Abidal Aziz selaku Ketua Pengurus Besar Nahdlatul Ulama (PBNU) sekaligus Staf Yaqut, dan Wakil Sekretaris Jenderal Pimpinan Pusat Gerakan Pemuda Ansor Syarif Hamzah Asyathry. Lalu pemilik agen perjalanan Maktour Travel, Fuad Hasan Masyhur; Pemilik PT Zahra Oto Mandiri (Uhud Tour) Khalid Zeed Abdullah Basalamah; Pemilik travel haji dan umrah PT Muhibbah Mulia Wisata Pekanbaru Ibnu Mas'ud; Sekretaris Kesthuri Muhammad Al Fatih; Divisi Visa Kesthuri Juahir; Ketua Sapuhi Syam Resfiadi; hingga Komisaris Independen PT Sucofindo Zainal Abidi. Tambahan kuota haji tersebut diperoleh setelah Presiden RI ke-7 Joko Widodo melakukan pertemuan bilateral dengan Putra Mahkota yang juga Perdana Menteri (PM) Kerajaan Arab Saudi Mohammed bin Salman Al-Saud pada 19 Oktober 2023 lalu. Berdasarkan Pasal 64 ayat 2 Undang-undang Nomor 8 Tahun 2019 tentang Penyelenggaraan Ibadah Haji dan Umrah, kuota haji khusus ditetapkan sebesar 8 persen dari kuota haji Indonesia. Kuota haji khusus terdiri atas jemaah haji khusus dan petugas haji khusus. Lebihnya yakni 92 persen diperuntukkan untuk kuota haji reguler. Tambahan kuota haji sebanyak 20.000 seharusnya dibagikan untuk jemaah haji reguler sebanyak 18.400 atau setara dengan 92 persen, dan kuota haji khusus sebanyak 1.600 atau setara dengan 8 persen. Dengan demikian, seharusnya haji reguler yang semula hanya 203.320 akan bertambah menjadi 221.720 orang. Sementara haji khusus yang semula 17.680 akan bertambah menjadi 19.280 orang. Namun, yang terjadi justru pembagiannya dibagi menjadi 10.000 untuk kuota haji reguler dan 10.000 untuk kuota haji khusus. Hal itu sebagaimana tertuang dalam Surat Keputusan (SK) Menteri Agama Nomor 130 Tahun 2024 yang ditandatangani Menteri Agama saat itu Yaqut Cholil Qoumas pada tanggal 15 Januari 2024. Berdasarkan perhitungan awal KPK, ditemukan kerugian negara dalam kasus dugaan korupsi kuota haji tambahan tahun 2023-2024 mencapai Rp1 triliun lebih. Temuan ini akan dikoordinasikan lebih lanjut dengan Badan Pemeriksa Keuangan (BPK). Dalam proses penyidikan berjalan, tepatnya pada 11 Agustus 2025, KPK mengeluarkan Surat Keputusan tentang larangan bepergian ke luar negeri untuk Yaqut Cholil Qoumas, staf khususnya Ishfah Abidal Aziz, dan pemilik agen perjalanan Maktour Travel, Fuad Hasan Masyhur.    KPK juga sudah menggeledah sejumlah tempat seperti rumah kediaman Yaqut di Condet, Jakarta Timur, kantor agen perjalanan haji dan umrah di Jakarta, rumah ASN Kementerian Agama di Depok, hingga ruang Direktorat Jenderal Penyelenggaraan Haji dan Umrah (PHU) Kementerian Agama. Banyak barang bukti diduga terkait perkara disita. Di antaranya dokumen, Barang Bukti Elektronik (BBE), hingga kendaraan roda empat dan properti. Baru-baru ini, KPK menyita dua unit rumah di Jakarta Selatan senilai Rp6,5 miliar milik salah seorang ASN di Ditjen PHU Kementerian Agama.",https://www.cnnindonesia.com/nasional/20250910185051-12-1272279/kpk-segera-tetapkan-dan-umumkan-tersangka-kuota-haji-dalam-waktu-dekat
1272234,Timnas Futsal Indonesia Siap Tumpas Denmark di Final CFAOlahraga,olahraga,"PelatihTimnas Futsal Indonesiadi CFA International Tournament 2025, Amril Daulay, mengaku siap menumpas Denmark dalam laga final, Kamis (11/9). Amril mengatakan, Indonesia akan tampil beda dibanding laga sebelumnya. Perbedaan ini menyesuaikan karakter main lawan. Bukan mengubah karakter main sendiri, tetapi bersiasat atas lawan. ""Untuk besok kami akan agak beda ya, karena Denmark ini posturnya besar, teknik bagus, skill full juga, mainannya banyak foreplay. Jadi agak bedalah strateginya,"" kata Amril, Rabu (10/9). ADVERTISEMENT SCROLL TO CONTINUE WITH CONTENT ""Jadi kita adaptasi juga. Besok yang pasti kita akan kasih 100 persen. Kami analisis, akan coba kami kasih yang yang terbaik. Kami tidak tahu nanti hasil seperti apa, tapi kasih yang terbaik."" Pada Rabu (10/9) pemain tidak menjalani latihan berat. Para pemain hanya diajak latihan ringan sambil diskusi kelas tentang gaya bermain yang akan dipraktikkan. ""Anak-anak juga sudah dikasih gambaran nanti bakal main seperti apa. Semoga besok bisa kasih yang terbaik dan seperti sebelumnya anak-anak ini cepat adaptasinya,"" katanya.  Timnas Futsal Indonesia melaju ke babak semifinal setelah mengalahkan Korea Selatan dengan skor 3-0. Adapun Denmark unggul dengan skor 1-0 atas Myanmar. Sebelumnya, Indonesia menjadi juara fase grup. Indonesia tak terkalahkan dalam tiga laga, melawan Selandia Baru, Myanmar, dan Kamboja. Performa Indonesia menonjol dalam turnamen ini.  [Gambas:Video CNN] ",https://www.cnnindonesia.com/olahraga/20250910165232-142-1272234/timnas-futsal-indonesia-siap-tumpas-denmark-di-final-cfa
