nama_fakultas,id_prodi,nama_prodi,judul,penulis,pembimbing_pertama,pembimbing_kedua,abstrak,abstrak_inggris
Hukum,1,Ilmu Hukum,Implementasi Fungsi Legislasi Dewan Perwakilan Rakyat Daerah Kabupaten Bangkalan Periode 2009-2014 Dalam Pembentukan Peraturan Daerah,Dyah Ayu Citra Seza,"Yudi Widagdo Harimurti, SH., MH","Safi', SH., MH","ABSTRAK Implementasi Fungsi Legislasi DPRD Kabupaten Bangkalan Periode 2009-2014 Dalam Pembentukan Peraturan Daerah menurut ketentuan Undang-Undang Dasar Negara Republik Indonesia Tahun 1945 maupun Undang-Undang Republik Indonesia Nomor 12 Tahun 2011 Tentang Pembentukan Peraturan Perundang-undangan dan Undang-Undang Republik Indonesia Nomor 32 Tahun 2004 Tentang Pemerintahan Daerah menentukan bahwa fungsi legislasi berada ditangan DPRD. Fungsi Legislasi yang dimiliki oleh DPRD merupakan fungsi pembentukan peraturan daerah (perda). Begitupula dengan DPRD Kabupaten Bangkalan yang memiliki fungsi legislasi tersebut dalam pembuatan peraturan daerah. Metode penelitian yang digunakan adalah yuridis normatif. Pendekatan masalah menggunakan pendekatan perundang-undangan (statute approach). Hasil penelitian ini menunjukkan bahwa dalam pelaksanaan fungsi legislasi DPRD Kabupaten Bangkalan dalam pembentukan peraturan daerah melalui beberapa tahapan yaitu melalui penyusunan program legislasi daerah (prolegda) dalam perencanaan penyusunan peraturan daerah sampai dengan proses sosialisasi rancangan peraturan daerah tersebut. Permasalahan atau kendala yang dihadapi DPRD Kabupaten Bangkalan dalam pembentukan peraturan daerah adalah masih minimnya sumber daya manusia yang memadai, adanya perbedaan cara pandang dari tiap anggota legislatif, adanya latar belakang partai politik yang mendominasi, kurangnya komunikasi politik antara pihak legislatif dalam hal ini DPRD Kabupaten Bangkalan sebagai lembaga legislatif dengan masyarakat tersebut serta tidak adanya kesepakatan antara pihak eksekutif (kepala daerah) dengan masyarakat terkait penyusunan rancangan peraturan daerah. Upaya yang dilakukan adalah kepala daerah dan DPRD harus bekerja sama demi kesejahteraan warga masyarakatnya dan kaitannya dengan pembentukan peraturan daerah DPRD tidak hanya kepala daerah saja yang dimintai pendapat tetapi masyarakat juga ikut dimintai pendapatnya. Pemerintah dan DPRD harus mendengar aspirasi dari warga masyarakatnya sehingga ada dengar pendapat antara pemerintah, DPRD dan warga masyarakat tentang peraturan yang dibuat.","ABSTRACT Implementation of Legislation Parliament function Bangkalan period 2009-2014 in accordance with local regulation Formation of the Constitution of the Republic of Indonesia Year 1945 and Law of the Republic of Indonesia Number 12 Year 2011 On Establishment of Legislation and Law of the Republic of Indonesia Number 32 Year 2004 on Regional Government determines that a legislative function in the hands of Parliament. Legislation functions held by Parliament is a function of the establishment of local regulations (regulations). Neither the Parliament Bangkalan having a legislative function is the creation of local regulations. The research method used is normative. Approach to the problem using this approach legislation (statute approach). The results of this study indicate that the implementation of the legislative functions of Parliament Bangkalan in the formation of local regulations through several stages of drafting program through local legislation (prolegda) preparation of local planning regulations to disseminate the draft local regulation. Problems or obstacles encountered in the formation of Parliament Bangkalan local regulation is still lack of adequate human resources, the different perspectives of each member of the legislature, Problems or obstacles encountered in the formation of Parliament Bangkalan local regulation is still lack of adequate human resources, the different perspectives of each member of the legislature, the background of the dominant political party, the lack of communication between the legislative politics in this Parliament as the legislature Bangkalan with the community and the lack of agreement between the executive (head area) with the drafting relevant regulations. Effort is the head area and Parliament should work together for the welfare of their peoples and local regulations related to the establishment of parliament is not only the head area are consulted but society also consulted. The government and parliament must hear the aspirations of their peoples so that no hearing between the government, Parliament and the community on the rules made."
Hukum,1,Ilmu Hukum,"Pertanggungjawaban Pidana Direksi BUMN (Persero)
(Anotasi Putusan No. 1144 K/Pid/2006)",Maulina Nurlaily,"Tolib Effendi, SH., MH.","Dr. Eni Suastuti, SH., Mhum.","Badan Usaha Milik Negara (BUMN) adalah Badan usaha yang sebagian atau seluruh modalnya dimiliki oleh Negara yang berasal dari kekayaan negara yang dipisahkan. Namun, segala ketentuan yang berlaku pada BUMN (Persero) mengacu pada Undang-undang Perseroan Terbatas. Tapi pada kenyataannya kasus yang terjadi pada Direksi BUMN (Persero), dimana Direksi harus bertanggungjawab secara pidana kususnya tindak pidana korupsi dalam Putusan Hakim No. 1144/K/Pid/2006. Hal tersebut dikarenakan sebagian modal modal BUMN (Persero) dimiliki negara. Jadi, ketika BUMN tersebut mengalami kerugian maka dianggap negara juga mengalami kerugian. Tujuan dari penulisan ini yaitu untuk mengetahui bagaimana pertanggungjawaban Direksi BUMN (Persero) ketika terjadi kerugian pada BUMN tersebut. Metode yang digunakan dalam penulisan ini yaitu yuridis normatif yang mana dalam penelitian ini menggunakan pendekatan statue approach (Pendekatan perundang-undangan) dan case approach (Pendekatan Kasus). Hasil yang diperoleh dalam penulisan ini yaitu Badan Usaha Milik Negara (BUMN) identik dengan Perseroan terbatas. Maka segala ketentuan yang berlaku pada BUMN (Persero) dan Pertanggungjawaban Direksi BUMN mengacu pada Undang-undang Perseroan Terbatas. Keyword: Pertanggungjawaban pidana, Direksi, Kerugian, BUMN","State Owned Enterprises (SOEs) are business entities that are partly or wholly owned by the State from the wealth separated state. However, all the provisions applicable to the state (Limited) refers to the Limited Liability Company Act. But in fact the case with the Board of Directors of SOEs (Limited), which the Board of Directors shall be criminally responsible kususnya corruption in Decision No. Hakim. 1144/K/Pid/2006. That is because most of the capital stock owned (Limited) owned by the state. So, when the state is experiencing a loss is considered the country also suffered losses. The purpose of this paper is to determine how the liability of Directors SOE (Limited) when there is a loss in the state. The method used in this paper is the normative juridical which in this study using the approach statue approach (Approach legislation) and case approach (Case Approach). The results obtained in this paper are State Owned Enterprises (SOEs) is identical to the limited liability company. So all the provisions applicable to the state (Limited) and refers to the state Board Accountability Act Company Limited. Keyword: criminal responsibility, the Board of Directors, Loss, SOE"
Hukum,1,Ilmu Hukum,Analisis Terhadap Kekosongan Hukum dalam Pengawasan Peredaran Prekursor,Moh. Samsul Hidayat,"Tolib Effendi, SH., MH.","Agus Ramdlany, SH., MH.","Kasus narkoba tidak henti-hentinya terdengar di media televisi, radio dan media cetak yang memberitakan tentang penyalahgunaan narkoba mulai dari penggunaan hingga peredaran gelapnya. Narkoba sangat memiliki harga nominal yang sangat tinggi, sehingga banyak orang menjadikan narkoba sebagai ladang bisnis, tanpa menghiraukan dampak bahaya ataupun resiko dari apa yang mereka lakukan. Seperti halnya bahan prekursor yang mana merupakan bahan pemula atau bahan kimia yang digunakan dalam berbagai kegiatan industri farmasi dan industri non farmasi dan untuk kegiatan pengembangan ilmu pengetahuan dan teknologi malah disalahgunakan sebagai bahan pembuat narkotika dan psikotropika dari sinilah bahan prekursor sangat perlu mendapatkan pengawasan khusus agar tidak disalahgunakan. Badan Narkotika Provinsi Jawa Timur merupakan lembaga yang menangani setiap permasalahan narkoba di seluru Wilayah Provinsi Jawa Timur. Dalam penanganan dan upaya pencegahan tindak pidana narkoba, Badan Narkotika Provinsi Jawa Timur melakukan pengawasan terhadap peredaran gelap prekursor dimana bertujuan agar bahan prekursor tidak disalah gunakan. Penelitian ini menggunakan metode Sosio Legal Research yang mana dalam penelitian ini menggunakan pendekatan fact/case approach yang di lakuka dengan cara menelaah terhadap kasus-kasus yang berkaitan dengan isu yang dihadapi atau fakta yang terjadi dilapangan. Badan Narkotika Provinsi Jawa Timur telah berhasil melakukan pengawasan terhadap peredaran gelap prekursor sebagai upaya pencegahan tindak pidana narkoba di Wilayah Provinsi Jawa Timur. Meskipun dalam hal ini masih membutuhkan banyak cara lain agar penyalahgunaan narkoba benar-benar dapat di berantas khususnya di Wilayah Provinsi Jawa Timur.","Drug cases endlessly heard on television, radio and print media preach about drug abuse ranging from the use and circulation of darkness. Drugs really have a very nominal price high, so many people make drugs as a farm business, regardless of the impact of hazards or risks of what they are doing. Just as the precursor material, which is the starting material or chemicals used in the pharmaceutical industry activities and non-pharmaceutical industries and for the development of science and technology instead abused as a narcotic and psychotropic maker of precursor material where it is necessary to get the special supervision so as not to misused. East Java Narcotics Agency is the agency that handles every drug problems across any area of East Java province. In the treatment and prevention of drug offenses, East Java Narcotics Agency oversight of illicit precursor wherein the precursor material is not intended to be misused. This study uses the Socio Legal Research which is in fact the research approach / case approach which lakuka by examining the cases related to issues faced or fact that occur in the field. East Java Narcotics Agency has successfully conducted surveillance of illicit precursor as prevention of drug offenses in the area of East Java province. Although in this case still needs a lot of other ways that drug abuse can completely eradicate, especially in areas in East Java province."
Hukum,1,Ilmu Hukum,PERLINDUNGAN HUKUM BAGI KONSUMEN ATAS PRODUK ELEKTRONIK YANG TIDAK MEMILIKI PANDUAN BAHASA INDONESIA,TOMMY ADITYA PARLINDUNGAN MARBUN,"DR. DJULAEKA, S.H., M.HUM","DR.USWATUN HASANAH, S.H., M. HUM","Produk elektronik adalah suatu benda bergerak yang dihasilkan melalui proses produksi oleh pengusaha elektronik berupa Peralatan atau alat yang bekerja berdasarkan kerja elektronika. Produk elektronik selalu update atau bervariasi baik dari segi bentuk maupun kecanggihannya, contohnya adalah televisi, radio, handphone, perekam kaset, perekam compact disc, kamera digital, kamera video dan lain-lain. Jenis-jenis produk elektronik tersebut merupakan barang yang sering digunakan dan telah menjadi kebutuhan setiap manusia karena banyak membantu pekerjaan manusia di kehidupan sehari-hari baik dalam efesiensi waktu maupun tenaga sehingga produk elektronik sangat diminati oleh manusia. Banyak beredar produk elektronik yang tidak memiliki panduan Bahasa Indonesia baik produk dalam negeri maupun produk luar negeri. Hal ini jelas telah melanggar Pasal 8 Ayat 1 huruf (j) UUPK, Peraturan Menteri Perdagangan Republik Indonesia Nomor 19/M-DAG/PER/5/2009 tentang Pendaftaran Petunjuk Penggunaan (Manual) Dan Kartu Jaminan/Garansi Purna Jual Dalam Bahasa Indonesia Bagi Produk Telematika Dan Elektronika dan juga Peraturan Menteri Perdagangan Republik Indonesia Nomor 22/M-DAG/PER/5/2010 tentang Kewajiban Pencantuman Label Pada Barang. Tujuan peneliti adalah untuk mengetahui apakah pelaku usaha yang menjual produk elektronik memiliki kewajiban untuk mencantumkan panduan bahasa Indonesia serta siapakah yang dapat digugat oleh konsumen yang mengalami kerugian atas produk elektronik yang tidak memiliki panduan bahasa Indonesia. Metode yang digunakan adalah yuridis normatif. Adapun pendekatan yang digunakan ialah pendekatan peraturan perundang-undangan (statute approach). Hasil dari penelitian ini menunjukkan bahwa produk elektronik termasuk barang yang wajib untuk mencantumkan buku panduan bahasa Indonesia dan jika produk elektronik tersebut di produksi dalam negeri maka produsen yang membuat produk elektronik harus bertanggung jawab sedangkan jika produk elektronik tersebut berasal dari luar negeri maka yang bertanggung jawab adalah importir sebagai pihak yang memasukkan produk elektronik tersebut ke wilayah Indonesia.","Electronic products is an object moves through the production process generated by electronics employers in the form of equipment or tool that works based on the work of electronics. Electronic products always update or varied in terms of both form and sophistication, for example, is television, radio, mobile phones, tape recorders, compact disc recorders, digital cameras, video cameras and others. The types of electronic products is a frequently used items and have become the need of every human being as a lot of work helping people in daily life both in time as well as energy efficiency that electronic products are in great demand by the people. Many outstanding electronic products that do not have a good guide to Indonesian domestic products and foreign products. This is a clear violation of Article 8 Paragraph 1 letter (j) of BFL, Regulation of the Minister of Trade of Republic of Indonesia Number 19/M-DAG/PER/5/2009 Registration User Guide (Manual) and Warranty Card/Aftermarket Warranty For In Indonesian Electronics and Telematics products and also Regulation of the Minister of Trade of the Republic of Indonesia No.22/M-DAG/PER/5/2010 on obligations Inclusion Label on Goods. The researchers' goal was to determine whether the businesses that sell electronic products have an obligation to provide guidance Indonesian and who can be sued by consumers who suffered losses from the electronic product that does not have a guide to Indonesian. The method used is normative. The approach used is to approach legislation (statute approach). The results of this study indicate that the electronic products including items required to include Indonesian guidebooks and if the electronic product in domestic production of the manufacturers who make electronic products should be responsible while if the electronic products come from overseas it is responsible importers as a party to enter the electronic products to Indonesia"
Hukum,24,Magister Ilmu Hukum,"PERTANGGUNG JAWABAN HUKUM PEJABAT PEMBUAT KOMITMEN  
( PPK) AKIBAT MALADMINISTRASI DALAM  
TINDAK PIDANA KORUPSI",MOCHAMAD SAICHU,"Dr. Nunuk Nuswardani S.H., M.H","Dr. Deni SB Yuherawan S.H., Msi","Korupsi tergolong ke dalam kejahatan yang luar biasa (extra ordinary crime). Korupsi yang terjadi di Indonesia saat ini sudah dalam posisi yang sangat akut dan begitu mengakar dalam setiap sendi kehidupan. Perkembangan praktek korupsi dari tahun ke tahun semakin meningkat, baik dari kuantitas atau jumlah kerugian keuangan negara maupun dari segi kualitas yang semakin sistematis, canggih serta lingkupnya sudah meluas ke dalam seluruh aspek masyarakat. Semua sepakat untuk memberantas tindak pidana korupsi namun ?ialam pemberantasan tersebut haruslah mengdepankan tentang penegakan hukum dan menjunjung tinggi kaidah-kaidah hukum yang berlaku, untuk menegadili seseorang terdakwa korupsi dapat dilihat terlebih dahulu peran maupun status hukum seseorang, bilamana seseorang tersebut dala kedudukan maupun statusnya dalam suatu jabatan tertentu sudah memenuhi atau sudah procedural dalam artian tidak cacat hukum maka pejabat tersebut dalam kapasitasnya dapat dituntut secara hukum terhadap tindakan yang dilakukan khuusnya dalam tindak pidana korupsi namun âpabila seseorang pejabat dalam kapasitas, maupun kedudukannya tidak prosedural atau cacat hukum maka dilihat terlebih dahulu kapasitas maupun kedudukannya tersebut dalam hukum administrasi karena sering kedudukan maupun kapasitas seorang pejabat yang cacat hukum akibat terjadinya maladministrasi sehingga demi kepastian hukum maka apabila seorang pejabat yang melanggar hukum dalam pengangkatannya maka haruslah pejabat tersebut diproses segala tindakannya sesuai dengan hukum administrsi Negara terlebih dahulu. Metode penelitian yang digunakan adalah jenis penelitian hukum normatif. Adapun yang dimaksud dengan jenis penelitian hukum normatif adalah penelitian yang didasarkan pada analisis terhadap bahan-bahan kepustakaan sebagai sumber data, beberapa asas hukum dan teori hukum serta peraturan Perundang-undangan yang sesuai dengan permasalahan dalam Tesis. Pendekatan yang digunakan adalah pendekatan Perundang-undangan (statute approach) dan case approach (pendekatan kasus), yaitu melakukan pendekatan dengan cara melakukan telaah, berkaitan dengan isu hukum yang dihadapi. Pengangkatan Pejabat Pembuat Komitmen (PPK) oleh Kuasa Pengguna Anggaran (KPA) yang tidak mempunyai kualifikasi dan tidak kompeten sesuai dengan Perpres No. 54 tahun 2010 tentang pengadaan barang dan jasa merupakan perbuatan maladministrasi sedangkan pengangkatan Pejabat Pembuat Komitmen (PPK) yang tidak memenuhi kualifikasi sesuai dengan Perpres No. 54 tahun 2010 tentang Pengadaan Barang dan Jasa dapat dikenai sanksi administrasi hal tersebut dikarenakan Pejabat Pembuat Komitmen (PPK) âdalah korban maladministrasi sehingga kedudukan Pejabat Pembuat Komitmen (PPK) adalah cacat hukum sehingga kedudukan Pejabat Pembuat Komitmen (PPK) tersebut tidak bisa dimintai pertanggungjawaban atas perbuatan yang berkaitan dengan kedudukannya sebagai Pejabat Pembuat Komitmen (PPK).","Korupsi tergolong ke dalam kejahatan yang luar biasa (extra ordinary crime). Korupsi yang terjadi di Indonesia saat ini sudah dalam posisi yang sangat akut dan begitu mengakar dalam setiap sendi kehidupan. Perkembangan praktek korupsi dari tahun ke tahun semakin meningkat, baik dari kuantitas atau jumlah kerugian keuangan negara maupun dari segi kualitas yang semakin sistematis, canggih serta lingkupnya sudah meluas ke dalam seluruh aspek masyarakat. Semua sepakat untuk memberantas tindak pidana korupsi namun ?ialam pemberantasan tersebut haruslah mengdepankan tentang penegakan hukum dan menjunjung tinggi kaidah-kaidah hukum yang berlaku, untuk menegadili seseorang terdakwa korupsi dapat dilihat terlebih dahulu peran maupun status hukum seseorang, bilamana seseorang tersebut dala kedudukan maupun statusnya dalam suatu jabatan tertentu sudah memenuhi atau sudah procedural dalam artian tidak cacat hukum maka pejabat tersebut dalam kapasitasnya dapat dituntut secara hukum terhadap tindakan yang dilakukan khuusnya dalam tindak pidana korupsi namun âpabila seseorang pejabat dalam kapasitas, maupun kedudukannya tidak prosedural atau cacat hukum maka dilihat terlebih dahulu kapasitas maupun kedudukannya tersebut dalam hukum administrasi karena sering kedudukan maupun kapasitas seorang pejabat yang cacat hukum akibat terjadinya maladministrasi sehingga demi kepastian hukum maka apabila seorang pejabat yang melanggar hukum dalam pengangkatannya maka haruslah pejabat tersebut diproses segala tindakannya sesuai dengan hukum administrsi Negara terlebih dahulu. Metode penelitian yang digunakan adalah jenis penelitian hukum normatif. Adapun yang dimaksud dengan jenis penelitian hukum normatif adalah penelitian yang didasarkan pada analisis terhadap bahan-bahan kepustakaan sebagai sumber data, beberapa asas hukum dan teori hukum serta peraturan Perundang-undangan yang sesuai dengan permasalahan dalam Tesis. Pendekatan yang digunakan adalah pendekatan Perundang-undangan (statute approach) dan case approach (pendekatan kasus), yaitu melakukan pendekatan dengan cara melakukan telaah, berkaitan dengan isu hukum yang dihadapi. Pengangkatan Pejabat Pembuat Komitmen (PPK) oleh Kuasa Pengguna Anggaran (KPA) yang tidak mempunyai kualifikasi dan tidak kompeten sesuai dengan Perpres No. 54 tahun 2010 tentang pengadaan barang dan jasa merupakan perbuatan maladministrasi sedangkan pengangkatan Pejabat Pembuat Komitmen (PPK) yang tidak memenuhi kualifikasi sesuai dengan Perpres No. 54 tahun 2010 tentang Pengadaan Barang dan Jasa dapat dikenai sanksi administrasi hal tersebut dikarenakan Pejabat Pembuat Komitmen (PPK) âdalah korban maladministrasi sehingga kedudukan Pejabat Pembuat Komitmen (PPK) adalah cacat hukum sehingga kedudukan Pejabat Pembuat Komitmen (PPK) tersebut tidak bisa dimintai pertanggungjawaban atas perbuatan yang berkaitan dengan kedudukannya sebagai Pejabat Pembuat Komitmen (PPK)."
Hukum,24,Magister Ilmu Hukum,KARAKTERISTIK KONTRAK PEMERINTAH PENGADAAN BARANG/JASA,"nanang hariansah, SH","Dr. DJULAEKA, SH., M.Hum","Dr. MURNI, SH., M.Hum","Kontrak pengadaan barang/jasa pemerintah adalah kontrak tertulis antara PPK dengan penyedia barang/jasa. Para pihak dalam kontrak hanya menjalankan aturan standart kontrak yang telah diatur dalam PERKA LKPP No. 14 Tahun 2012 Tentang Petunjuk Teknis Perpres No 70 Tahun 2012 Tentang Pengadaan Barang/Jasa Pemerintah tanpa adanya persesuaian kehendak. Kontrak pengadaan barang/jasa berbeda dengan kontrak pada umumnya karena dalam kontrak tersebut terdapat unsur hukum publik di dalamnya. Penelitian yang digunakan dalam penulisan ini adalah penelitian hukum normatif dengan menggunakan pendekatan perundang-undangan (statute approach) dan pendekatan konsep (conseptual approach). Dalam kontrak pengadaan barang/jasa unsur hukum publik melebur (opplosing) dalam perbuatan hukum keperdataan, akan tetapi bukan tidak mungkin berbagai ketentuan hukum publik (Hukum Tata Usaha Negara) akan mempengaruhi peraturan hukum perdata. Dalam hal yang demikian maka PPK dapat melakukan tindakan sepihak (Beschiking). atas dasar kewenangannya PPK dapat menggunakan paksaan pemerintahan, atau menerapkan sanksi-sanksi hukum. Hal ini tentunya berpengaruh pada tindakan hukum terkait pembatalan, perubahan, dan pemutusan kontrak, dalam kaitan ini perlu adanya perlindungan hukum terhadap penyedia. Kata Kunci: Kontrak Pengadaan Barang/Jasa,Karakteristik,Perlindungan Hukum","Government goods/service supplying contractt is a kind of written contract between PPK and goods/service supplier. All parties in the contract only run the standard rules of contract which are arranged in PERKA LKPP No. 14 Year 2012 About Perpres Technical Guidelines No. 70 Year 2012 About Government Goods/Service Supplying without intention compatibility. The contract of goods/service supplying is different with the common contract because in that contract, there is a substance of public law. The analysis that is used in this study is normative law analysis by using statute approach and conceptual approach. In goods/service supplying contract, a substance of public law melts in a deed of civil law, however it is not an exceptional for several provisions of public law (Administrative Law) to give an influence to the rules of civil law. In this case, PPK can do a unilateral action. Certainly, this case gives an influence to the law action in line with nullification, alteration, and contract dissolution, due to that condition, it is important to have a law protection for the supplier. Keywords: Goods/Service Supplying Contract, Characteristic, Law inforcement."
