nama_fakultas,id_prodi,nama_prodi,judul,penulis,pembimbing_pertama,pembimbing_kedua,abstrak,abstrak_inggris
Ilmu Sosial Dan Ilmu Budaya,15,Sastra Inggris,"A study of Conjunction Translation in the novel ""The Old Man and The Sea"" and Its Translation",Atik Husnia,"Sriyono, SS.,M.Hum","Rosyida Ekawati, SS.MA","ABSTRACT Husnia, Atik. 08.05.111.00017. A Study of Conjunction Translation in the Novel The Old Man and The Sea and Its Translation. Thesis. English Study Program of the Faculty of Social and Cultural Sciences, Trunojoyo Madura University. Advisors: (I) Sriyono, S.S., M.Hum. (II) Rosyida Ekawati, SS., MA. This study concerns about translation, especially kinds and procedure in translating conjunction in the novel The Old Man and The Sea. This study aimed to identify the translation variation of English conjunctions in the novel The Old Man and the Sea and its translation and explain the procedure that is applied by translator in transferring English conjunction from source text into target text. Moreover, this study analyzes the conjunction translation uses Halliday and Hassan’s theory that is found in the novel The Old Man and The Sea. The seven procedures of translation which are proposed by Vinay and Darberlnet in Venuti is also involved in analyzing the data. Qualitative design is applied in this study because the data were collected and analyzed in the form of words. The data of this study is the conjunctions found in the novel. The findings found four types in translating conjunction. They are literal translation of English conjunction, translation variation of English conjunction into Indonesian conjunction, translation of English conjunction into Indonesian non-conjunction, and zero-translation of English conjunction. Furthermore, literal translation, modulation, and transposition procedure are the most applied in translating conjunction from source text into target text. Keywords: translation, conjunction, procedure of translation","ABSTRACT Husnia, Atik. 08.05.111.00017. A Study of Conjunction Translation in the Novel The Old Man and The Sea and Its Translation. Thesis. English Study Program of the Faculty of Social and Cultural Sciences, Trunojoyo Madura University. Advisors: (I) Sriyono, S.S., M.Hum. (II) Rosyida Ekawati, SS., MA. This study concerns about translation, especially kinds and procedure in translating conjunction in the novel The Old Man and The Sea. This study aimed to identify the translation variation of English conjunctions in the novel The Old Man and the Sea and its translation and explain the procedure that is applied by translator in transferring English conjunction from source text into target text. Moreover, this study analyzes the conjunction translation uses Halliday and Hassan’s theory that is found in the novel The Old Man and The Sea. The seven procedures of translation which are proposed by Vinay and Darberlnet in Venuti is also involved in analyzing the data. Qualitative design is applied in this study because the data were collected and analyzed in the form of words. The data of this study is the conjunctions found in the novel. The findings found four types in translating conjunction. They are literal translation of English conjunction, translation variation of English conjunction into Indonesian conjunction, translation of English conjunction into Indonesian non-conjunction, and zero-translation of English conjunction. Furthermore, literal translation, modulation, and transposition procedure are the most applied in translating conjunction from source text into target text. Keywords: translation, conjunction, procedure of translation"
Ilmu Sosial Dan Ilmu Budaya,15,Sastra Inggris,The Universal Narrative Structure in John Steinbeck's Tortilla Flat,Mochammad Hanif,"Imron Wakhid Harits, SS., M.Pd.","Rifah Inayati, SS., MA.",,"ABSTRACT Hanif, Mochammad. 08.05.111.00027. The Universal Narrative Structure in John Steinbecks Tortilla Flat. Thesis. English Study Program of the Faculty of Social and Cultural Science, University of Trunojoyo Madura. Advisors: (I) Imron Wakhid Harits, S.S,M.Pd. (II) Rifah Inayati, S.S. M. A John Steinbecks Tortilla Flat tells about the life of Paisano. There are six characters that live in the house. They are Danny, Pilon, Pablo, Jesus Maria, Pirate, and Big Joe. They face the economical problem and live in Dannys house. Living in one house really gives the effect for the relation of those characters in reaching their ambitions. This study is qualitative research. In addition, the theory used to analyze the novel is Greimas Structuralism. This theory is used to find the universal narrative structure in the novel. It is divided into two parts, those are actantial structure and functional structure. Functional structure is subdivided into two parts, those Greimas functions and functional model. Based on the analysis, it can be concluded that there are eight schemes of actantial structure that can be identified in the novel. However, there are only three schemes of actantial structure which have the receiver. Therefore, there are only three struggles that reach the last situation in functional model. Among twenty functions of functional structure, there are twelve functions that can be identified in the novel. Key Words: Greimas, Actantial structure, functional structure, Greimas functions, functional model."
Ilmu Sosial Dan Ilmu Budaya,15,Sastra Inggris,A Study of Conversational Implicature Uttered By The Main Characters In Dinner For Schmucks Film,Deny Andrianto,"Sriyono, SS., M.Hum","Iqbal Nurul Azhar, SS., M.Hum","ABSTRACT Andrianto, Deny. 08.05.111.00057. A Study of Conversational Implicature Uttered by The Main Characters in Dinner for Schmucks Film. Thesis. English Study Program of the Faculty of Social and Cultural Sciences, University of Trunojoyo Madura. Advisors: (I) Sriyono, S.S., M.Hum. (II) Iqbal Nurul Azhar, S.S., M.Hum. This study focuses on conversational implicature uttered by the main characters in Dinner for Schmucks film. This study aims to identify the kind of conversational implicature mostly uttered by the main characters in Dinner for Schmucks film and the mechanisms used by the main characters to utter conversational implicature in Dinner for Schmucks film. In addition, to analyze the data, this study uses Grice’s theory who divides conversational implicature into generalized and particularized conversational implicature. This study also uses the theory of Grice related to the mechanisms of creating conversational implicature. Moreover, this study is conducted using a qualitative design because the data are in the form of words. The data of this study are the utterances of the main characters (Tim and Barry) when they have conversation. The data of this study are collected by using content analysis method. The data analysis reveals the findings covering the formulated research questions. Firstly, the kind of conversational implicature mostly uttered by the main characters in Dinner for Schmucks film is particularized conversational implicature. It is demonstrated by 20 data or 68,9% of the data categorized as particularized conversational implicature. The second position goes to generalized conversational implicature. It is shown by 7 data or 24,2% of the data classified into generalized conversational implicature. In addition, in Dinner for Schmucks, it is found that one conversation contains both generalized and particularized conversational implicature. It is proved by 2 data or 6,9% of the data which contains both generalized and particularized conversational implicature. Moreover, the main characters use the mechanisms of standard implicature and a deliberately flouting four maxims of cooperative principle to utter conversational implicature. Keywords: Conversational Implicature, The Mechanisms, Dinner for Schmucks Film","ABSTRACT Andrianto, Deny. 08.05.111.00057. A Study of Conversational Implicature Uttered by The Main Characters in Dinner for Schmucks Film. Thesis. English Study Program of the Faculty of Social and Cultural Sciences, University of Trunojoyo Madura. Advisors: (I) Sriyono, S.S., M.Hum. (II) Iqbal Nurul Azhar, S.S., M.Hum. This study focuses on conversational implicature uttered by the main characters in Dinner for Schmucks film. This study aims to identify the kind of conversational implicature mostly uttered by the main characters in Dinner for Schmucks film and the mechanisms used by the main characters to utter conversational implicature in Dinner for Schmucks film. In addition, to analyze the data, this study uses Grice’s theory who divides conversational implicature into generalized and particularized conversational implicature. This study also uses the theory of Grice related to the mechanisms of creating conversational implicature. Moreover, this study is conducted using a qualitative design because the data are in the form of words. The data of this study are the utterances of the main characters (Tim and Barry) when they have conversation. The data of this study are collected by using content analysis method. The data analysis reveals the findings covering the formulated research questions. Firstly, the kind of conversational implicature mostly uttered by the main characters in Dinner for Schmucks film is particularized conversational implicature. It is demonstrated by 20 data or 68,9% of the data categorized as particularized conversational implicature. The second position goes to generalized conversational implicature. It is shown by 7 data or 24,2% of the data classified into generalized conversational implicature. In addition, in Dinner for Schmucks, it is found that one conversation contains both generalized and particularized conversational implicature. It is proved by 2 data or 6,9% of the data which contains both generalized and particularized conversational implicature. Moreover, the main characters use the mechanisms of standard implicature and a deliberately flouting four maxims of cooperative principle to utter conversational implicature. Keywords: Conversational Implicature, The Mechanisms, Dinner for Schmucks Film"
Keislaman,16,Ekonomi Syariah,“PENERAPAN SHARIA MARKETING MIX  DALAM MENINGKATKAN VOLUME PENGGUNA JASA TRAVEL HAJI DAN UMRAH DI PT ESQ TOURS TRAVEL”,MOH. MUHLIS ANWAR,"LAILATUL QADARIYAH, S.H.I, M.E.I",-,"ABSTRAK Penelitian ini akan membahas tentang penerapan sharia marketing mix dalam meningkatkan volume pengguna jasa travel haji dan umrah (studi kasusu pada biro perjalanan haji dan umrah PT. ESQ Tours Travel). Fokus Permasalahan yang akan dibahas adalah ; (1) Bagaimakah penerapan sharia marketing mix yang dilakukan oleh PT. ESQ Tours Travel, (2) Bagaimanakah penerapan sharia marketing mix dalam meningkatkan volume pengguna jasa travel haji dan umrah di PT. ESQ Tours Travel. Penelitian ini dilakukan dengan menggunakan pendekatan kualitatif yaitu metode penelitian kualitatif analisis deskripsi. Penelitian kualitatif adalah suatu penelitian yang ditujukan untuk mendeskripsikan dan menganalisis fenomena, peristiwa, aktifitas social, sikap, kepercayaan, persepsi, pemikiran orang secara individual maupun kelompok. Sehingga dalam teknik penggalian data peneliti menggunakan metode observasi, wawancara mendalam, dan dokumentasi. Dari metode penelitian kualitatif deskriptif maka peneliti bisa melihat proses penerapan sharia marketing mix di PT. ESQ Tours Travel Berdasarkan hasil penelitian disimpulkan bahwa PT. ESQ Tours Travel menerapkan sharia marketing mix dengan sangat baik. Hal tersebut bisa dilihat dari cara penyajian produk (produck) layanan umrah yang yang jelas dan transparan, meninggalkan perang harga (price) tapi berlomba dalam memberikan pelayanan yang terbaik, menggunakan kantor sendiri sebagai / tempat (place) pemasaran dan bebas ghasab, melakukan promosi (promotion) sesuai syar’i dengan pelayanan yang prima agar jamaah mendapatkan kepuasan melaksanakan unrah bersama PT. ESQ Tours Travel. Volume jamaah umrah ESQ semakin meningkat dalam setiap tahunnya hingga 19.99 %. Kata Kunci : Sharia Marketing Mix, Volume, Peningkatan Jamaah Umrah","ABSTRACT This research is going to discuss about the application of Sharia marketing mix in increasing the volume of the users of Hajj and Umrah travel service (retrospective case series study on Hajj and Umrah travel agency of PT. ESQ Tours Travel). The focus Issues will be discussed below; (1) How is the application of Sharia marketing mix made by PT. ESQ Tours Travel, (2) How is the application of Sharia marketing mix increasing the volume of the users of Hajj and Umrah travel service in PT. ESQ Tours Travel. This research was conducted by using a qualitative approach, qualitative research methods of descriptive analysis. Qualitative research is a study which is aimed to describe and analyze the phenomena, about social activities, attitudes, beliefs, perceptions, and thoughts of individual or collective people. So that, in the data deepening techniques the researchers used the observation method, in-depth interviews, and documentation of descriptive qualitative research method, the researcher can observe the process of applying sharia marketing mix in PT. ESQ Tours Travel. Based on the results of the research it can be concluded that the PT. ESQ Tours Travel implements sharia marketing mix is very well. It can be seen from the way of the umrah service product presentation (production) that is clear and transparent, then leaving the price war (price) but it competes to provide the best service, then using its own office as marketing place (place) and free from ghasab, then promotion (promotion) according to sharia with excellent service, in order pilgrims to get satisfaction from carrying umrah by using PT. ESQ Tours Travel. ESQ Umrah pilgrim volume is more and more increasing every year up to 19.99%. Keywords: Sharia Marketing Mix, Volume, Umrah pilgrims Improvement, PT. ESQ Tours Travel"
Keislaman,16,Ekonomi Syariah,"Pengaruh Biaya Ijarah, Prosedur Pencairan dan Pelayanan Terhadap Minat Nasabah dalam Menggadaikan Emas di PT. BRI Syariah KCP Bangkalan",Fatima,"Lailatul Qadariyah, S.HI., M.EI",,"Penelitian yang berjudul pengaruh biaya ijarah, prosedur pencairan dan pelayanan terhadap minat nasabah dalam menggadaikan emas di PT. BRI Syariah KCP Bangkalan yang di latar belakangi oleh keinginan untuk mengetahui bagaimana pengaruh biaya ijarah, prosedur pencairan dan pelayanan terhadap minat nasabah dalam menggadaikan emas di PT. BRI Syariah KCP Bangkalan. Jenis penelitian ini adalah penelitian kuantitatif. Penelitian kuantitatif dapat diartikan sebagai metode penelitian yang berlandaskan pada filsafat positivisme, digunakan untuk meneliti pada populasi atau sampel tertentu, teknik pengambilan sampel biasanya random, pengumpulan data menggunakan instrumen penelitian, analisis data bersifat kuantitatif/statistik dengan tujuan untuk menguji hipotesis yang telah ditetapkan. Populasi dalam penelitian ini meliputi semua nasabah yang menggunakan produk gadai emas syariah PT. BRI Syariah KCP Bangkalan. Sedangkan sampel nasabah yang diambil adalah 100 nasabah yang pernah melakukan gadai emas di PT. BRI Syariah KCP Bangkalan. Pemilihan sampel penelitian dilakukan dengan purposive sampling. Data yang digunakan dalam penelitian ini adalah data primer, karena data didapat secara langsung dari nasabah melalui pembagian kuesioner. Metode analisis data yang digunakan adalah analisis kuantitatif dengan menggunakan uji validitas dan uji reliabilitas, uji asumsi klasik, uji F, uji t dan analisis regresi linier berganda. Hasil pengujian menunjukkan secara simultan ketiga variabel independen, yaitu biaya ijarah, prosedur pencairan dan pelayanan berpengaruh signifikan terhadap variabel dependen, yaitu minat nasabah dalam menggadaikan emas di PT. BRI Syariah KCP Bangkalan. Dari hasil uji parsial, menunjukkan bahwa variabel biaya ijarah dan prosedur pencairan tidak berpengaruh signifikan terhadap minat nasabah dalam menggadaikan emas di PT. BRI Syariah KCP Bangkalan sementara yang berpengaruh signifikan terhadap minat nasabah dalam menggadaikan emas di PT. BRI Syariah KCP Bangkalan adalah variabel pelayanan. Kata kunci : biaya ijarah, prosedur pencairan, pelayanan dan minat.","The research is entitled the impact of ijarah costs, disbursement procedures and services to the customer interest of gold pawn in PT. BRI Syariah KCP Bangkalan. This research purposes to know the impact of ijarah costs, disbursement procedures and services to the customer interest of gold pawn in PT. BRI Syariah KCP Bangkalan. This research is quantitative research. Quantitative research was interpreted as a research method that is based on the philosophy of positivism, it is used to examine the population or a particular sample with random sampling technique, data collection using research instruments, data analysis belong to quantitative / statistics type to test the hypothesis that has been set. The population in this research included all customers who use the products of gold pawn in PT. BRI Syariah KCP Bangkalan. Samples are taken from 100 customers who had done a gold pawn activities in PT. BRI Syariah KCP Bangkalan. The Selection of the sample is based on purposive sampling. This research use primary data, it is obtained directly from customers by questionnaires distribution. Quantitative analysis is done by validity and reliability test, the classical assumption test, F test, t test and multiple linear regression analysis. The result of this research shows that three independent variables, such as ijarah costs, disbursement procedures and services have a significant impact on the dependent variable simultaneously to the customers interest of gold pawn in PT. BRI Syariah KCP Bangkalan. The result of partial test shows that the variable ijarah costs and disbursement procedure does not give impact significantly to the customers interest of gold pawn in PT. BRI Syariah KCP Bangkalan. While, variable services has significantly impact to the customers interest of gold pawn in PT. BRI Syariah KCP Bangkalan. Keywords : ijarah costs, disbursement procedures, services and interests."
Keislaman,16,Ekonomi Syariah,"TINJAUAN EKONOMI ISLAM TERHADAP PENGUPAHAN KARYAWAN PADA KONVEKSI STAR NINE Group
Studi Kasus pada Konveksi Star Nine Group
Desa Tritunggal Babat Lamongan Jawa Timur",VIVID NUR LAILI,"Dr. Abdur Rohman, S.Ag.,M.E.I NIP. 197408152008121005",,"Penelitian ini akan membahas tentang tinjauan Ekonomi Islam terhadap praktek pengupahan karyawan konveksi Star Nine Group (Studi Kasus pada konveksi Star Nine Group Desa Tritunggal Babat Lamongan). Fokus permasalahan yang akan dibahas adalah: (1) Bagaimana praktik pengupahan karyawan yang dilakukan konveksi Star Nine Group, (2) Bagaimana pengupahan karyawan konveksi Star Nine Group dalam tinjauan Ekonomi Islam. Penelitian ini dilakukan dengan menggunakan pendekatan kualitatif. Teknik pengumpulan data yang dilakukan adalah melalui observasi langsung ke lapangan, wawancara dengan pemilik perusahaan dan karyawan serta menggunakan cara dokumentasi dengan memanfaatkan data-data dan dokumen perusahaan. Berdasarkan hasil penelitian menunjukkan bahwa hampir sebagin besar praktik pengupahan karyawan pada konveksi Star Nine Group belum sesuai dengan konsep Ekonomi Islam, karena jika dikaji dari sisi kontrak kerja yang hanya disepakati secara lisan sehingga tidak mempunyai legalitas hukum yang kuat, proses penentuan upah belum dilakukan secara objektif dan subjektif, upah yang diberikan belum sesuai dengan prinsip keadilan dan kelayakan pengupahan Islami, serta adanya unsur ketidakadilan dalam pemenuhan hak karyawan. Kata Kunci: Upah, Upah dalam Perspektif Ekonomi Islam.","This research will discuss the Islamic Economic review of the practice of employee remuneration convection Star Nine Group (Case Study on convection Star Nine Group Desa Tritunggal Babat Lamongan Jawa Timur) . Focus issues to be discussed are : (1) How do employees remuneration practices convection Star Nine Group , (2) How the remuneration of employees convection Star Nine Group in reviews Islamic Economics . This research was conducted by using a qualitative approach . Data collection techniques is done through direct observation to the field , interviews with business owners and employees and use the documentation by using the data and documents of the company. Based on the results of the study showed that nearly most of his employees on remuneration practices convection Star Nine Group is not in accordance with the concept of Islamic Economics, because when examined in terms of the employment contract which only agreed verbally that does not have a strong legality, the process of wage determination has not been made objectively and subjectively, given wages not in accordance with the principles of fairness and feasibility of Islamic wages, as well as the element of injustice in the fulfillment of the rights of employees . Keywords : Wages , Wage in Islamic Economic Perspective"
Keislaman,16,Ekonomi Syariah,Pengaruh Pembiayaan Murabahah terhadap Pemberdayaan Usaha Ekonomi Mikro (Study Kasus Koperasi BMT-Maslahah Cabang Pabean Surabaya),Ana Ayu Arbaatus Sholichah,"Dr.Abdur Rohman, S.Ag.,M.EI",-,"Penelitian yang berjudul pengaruh pembiayaan Murabahah terhadap pemberdayaan usaha ekonomi mikro pada Koperasi BMT-Maslahah Cabang Pabean Surabaya yang di latar belakangi oleh keinginan untuk mengetahui bagaimana profil usaha mikro yang menjadi nasabah pembiayaan Murabahah dan Bagaimana pengaruh pembiayaan Murabahah terhadap pemberdayaan usaha ekonomi mikro pada Koperasi BMT-Maslahah Cabang Pabean Surabaya. Jenis penelitian ini adalah penelitian kuantitatif. Penelitian kuantitatif dapat diartikan sebagai metode penelitian yang berlandaskan pada filsafat positivisme, digunakan untuk meneliti pada populasi atau sampel tertentu, teknik pengambilan sampel biasanya random, pengumpulan data menggunakan instrumen penelitian, analisis data bersifat kuantitatif/statistik dengan tujuan untuk menguji hipotesis yang telah ditetapkan. Populasi dalam penelitian ini meliputi nasabah yang memiliki usaha mikro dan mendapatkan pembiayaan Murabahah pada Koperasi BMT-Maslahah Cabang Pabean Surabaya. Sedangkan sampel nasabah yang diambil sebanyak 58 responden, jumlah tersebut diambil dari 50% jumlah populasi yaitu 116 responden. Pemilihan sampel penelitian dilakukan dengan purposive sampling. Data yang digunakan dalam penelitian ini adalah data primer dan data sekunder. Metode analisis data yang digunakan adalah analisis kuantitatif dengan menggunakan uji validitas dan uji reliabilitas, uji asumsi klasik, uji F, uji t dan analisis regresi linier sederhana. Hasil penelitian menunjukkan bahwa usaha mikro ini dimiliki oleh orang-perorangan, tidak berbentuk badan hukum dan juga belum memiliki surat ijin usaha resmi dari dinas terkait, usaha yang masih tergolong relatif rendah akan modal yang tersedia dan hasil pengujian mmenunjukkan bahwa pembiayaan Murabahah berpengaruh signifikan terhadap variabel dependen, yaitu pemberdayaan usaha ekonomi mikro pada Koperasi BMT-Maslahah Cabang Pabean Surabaya. Dari hasil Uji T, menunjukkan bahwa nilai t hitung (9,979) > nilai t tabel (1,672) dan H0 ditolak. Jadi terdapat pengaruh signifikan antara variabel pembiayaan Murabahah terhadap pemberdayaan usaha ekonomi mikro pada Koperasi BMT-Maslahah Cabang Pabean Surabaya. Kata kunci : Pembiayaan Murabahah, Pemberdayaan dan Usaha Ekonomi Mikro.","The study entitled influence Murabahah financing to micro economic empowerment of the BMT-Maslahah Cooperation Branch Pabean Surabaya is motivated by desire to find out how the customers profile Murabahah financing to micro economic empowerment of the BMT-Maslahah Cooperation Branch Pabean Surabaya. Type of research is a quantitative. The research method that is based on the piloshopy of positivisme, used to examine the population or particular sample, usually random sampling techniques, quantitative data analysis/statistic with the testing hypothesis wich has been in set. The population in this study include customers who own business micro and Murabahah financing at BMT-Maslahah Cooperation Branch Pabean Surabaya. The customers sample taken 50% of the total population are 116 respondens, the collection sample of research do with purposive research. Data that is used in this research is primary data and secondary data. Methode in use the quatitative analysis using validity and reliability, the classical asumtion test, F-test, T-test and linier regressing analysis simple. The result showed that the micro business own by the individual, isn’t a legal entity, and also doesn’t have an official business ficense from the relevant agency, the business still are relative low capital available and the test result that Murabahah financing give significant effect on the variable dependent, is micro economic empowerment in BMT-Maslahah Cooperation Branch Pabean Surabaya. From T-test showed that the calculated value : (9,979) > T-Value table : (1,672) and H0 refused. So were significant effect among variables Murabahah financing for economic empowerment of the BMT-Maslahah Cooperation Branch Pabean Surabaya. Keywords : Murabahah Financing, Economic Empowerment and Micro Economic Enterprise"
Keislaman,17,Hukum Bisnis Syariah,PENETAPAN UJROH DI PEGADAIAN SYARIAH BANGKALAN DALAM TINJAUAN HUKUM ISLAM,MUHAMMAD HENDRIK,"H. ACH. MUS'IF, S.HI., MA",,,
