nama_fakultas,id_prodi,nama_prodi,judul,penulis,pembimbing_pertama,pembimbing_kedua,abstrak,abstrak_inggris
Pertanian,5,Ilmu Kelautan,"ANALISA KANDUNGAN GIZI DAN SENYAWA BIOAKTIF KEONG BAKAU (Telescopium telescopium) DI PERAIRAN SEPULU DAN SOCAH
KABUPATEN BANGKALAN",KIRNO MARJUKI,"Hafiluddin, S.Pi., M.Si","Haryo Triajie, S.Pi., M.Si","Keong Bakau (Telescopium telescopium), merupakan salah satu jenis gastropoda yang ditemukan dalam jumlah melimpah pada daerah bakau dan tambak. Biota ini memiliki nilai ekonomis dan banyak dikonsumsi dijadikan lauk pauk, serta memiliki khasiat sebagai obat asma. Tujuan dari penelitian ini adalah untuk menganalisis kandungan proksimat Telescopium telescopium di perairan Sepulu dan Socah, serta senyawa bioaktif Telescopium telescopium. Hasil analisa proksimat pada perairan Sepulu memiliki protein sebesar 12,43%, lemak 4,12%, kadar air 77,08%, kadar abu 2,77%, dan karbohidrat 3,60%. Hasil analisa proksimat di perairan Socah didapatkan protein sebesar 12,26%, lemak 4,60%, kadar air 77,66%, dan kadar abu 2,50%, serta karbohidrat 2,98%. Ekstrak kasar dengan pelarut metanol pada perairan Sepulu dan Socah yang dikomposit, didapatkan rendemen sebesar 0,27%. Hasil uji senyawa bioaktif ekstrak kasar daging Telescopium telescopium adalah alkaloid, steroid, flavonoid, gula pereduksi, dan ninhidrin. Sedangkan untuk senyawa fenol hidrokuinon, karbohidrat, peptide, saponin, dan tannin tidak terdeteksi. Kata kunci : Telescopium telescopium, Analisa Proksimat, Senyawa Bioaktif.","Mangrove shells (Telescopium telescopium), are on of gastrophodes which are found in large quantities in mangrove areas and fish ponds. These shells has economical value and are consumed as dishes, and also has the avantage as asthma medicine. The purpose of this researchs are to analyse the content of proximate and bioactive compounds Telescopium telescopium in Sepulu and Socah. The result of proximate analysis in Sepulu coastal, have the protein about 12,43%, fat 4,12 %, water content 77,08 %, ash degree 2,77 %, and carbohydrate 3,60 %. The result of proximate analysis in Socah coastal, have the protein about 12,26 %, fat 4,60 %, water content 77,66 %, ash 2,50 %, and carbohydrate 2,98%. The crude extract abtained was added methanol solution has yield of about 0,27%. The result of the bioactive compounds of crude extract Telescopium telescopium are alkaloids, steroids, flavonoids, reducting sugars, and ninhydrin. While hidrokuinone phenol compounds carbohydrates, peptides, saponins, and tannins are not detected. Keywords : Telescopium telescopium, Analysis Proxsimates, Compound Bioactive."
Pertanian,5,Ilmu Kelautan,PENYUSUNAN MODEL ALGORITMA PENDUGA KONSENTRASI KLOROFIL-A MENGGUNAKAN CITRA SATELIT ASTER DI PERAIRAN KWANYAR BANGKALAN,MOHAMMAD FATHONI,"Firman Farid Muhsoni, S.Pi., M.Sc","Achmad Fachruddin Syah, S.Pi., M.Si","ABSTRAK Dinamisnya pembangunan dan eksploitasi kawasan pesisir secara besar-besaran dapat menyebabkan penurunan kondisi fungsi ekosistem perairan. Hal tersebut akan merugikan manusia. Potensi bahaya yang dapat terjadi menuntut adanya sistem kontrol yang baik, salah satunya dengan memantau kualitas perairan pesisir secara berkesinambungan. Teknologi penginderaan jauh adalah metode yang cukup baik dalam memantau kualitas air. Pemanfaatan citra satelit ASTER dengan 14 band, informasi oseanografi yang diperoleh diharapkan akan lebih baik dan akurat. Penelitian ini mencoba menggali potensi aplikasi data citra satelit ASTER untuk menentukan salah satu parameter kualitas air yaitu konsentrasi klorofil-a. Penelitian ini bertujuan merancang dan membuat model algoritma penduga konsentrasi klorofil-a serta menganalisis hubungan data lapang dengan respon spektral citra ASTER. Penyusunan algoritma penduga konsentrasi klorofil-a pada penelitian ini menggunakan kombinasi band (Bandaktif/Bandreference) dan ((Bandaktif -Bandreference)/(Bandaktif+Bandreference)). Data citra yang digunakan yaitu band 1 dan band 2 sensor satelit citra ASTER. Metode dalam penyusunan algoritma penduga konsentrasi klorofil-a menggunakan metode regresi, dimana metode regresi digunakan untuk memanfaatkan persamaan regresi untuk mengubah nilai pada citra menjadi nilai baru yang menggambarkan kecenderungan fenomena tertentu. Selanjutnya dilakukan pengujian nilai konsentrasi klorofil-a dengan menggunakan uji akurasi dengan metode RMSE. Hasil analisis penelitian algoritma penduga konsentrasi klorofil-a di perairan Kwanyar Kabupaten Bangkalan yaitu [Chl-a] = - 76,780 + 66,164 Ln (B1) – 50,771 Ln (B2) dengan nilai koefisien korelasi dan determinasi (r = 0,591, R = 34,9 %) serta nilai RMSE 2,374. Kata kunci: Citra ASTER, Algoritma Penduga Klorofil-a, Metode Regresi.","ABSTRACT Dynamic development and exploitation of coastal areas on a large scale can cause deterioration of aquatic ecosystems function. It would be detrimental to humans.Potential dangers that can occur requires a good control system, one with coastal water quality monitoring on an ongoing basis. Remote sensing technology is a pretty good method to monitor water quality. Use of ASTER satellite imagery with 14 bands, oceanographic information obtained is expected to be better and more accurate. This study tries to explore the potential application of ASTER satellite image data to determine a water quality parameter is the concentration of chlorophyll-a. This study aims to design and make models of algorithms estimate the concentration of chlorophyll-a and analyze field data relationships with ASTER spectral response image.Preparation of the algorithm estimate chlorophyll-a concentrations in this study using a combination band (Bandaktif/Bandreference) dan ((Bandaktif -Bandreference)/(Bandaktif+Bandreference)). Image data used is band 1 and band 2 satellite sensor ASTER imagery. Probe method in the preparation of algorithms of chlorophyll-a concentration using the regression method, where the regression method used to exploit the value of the regression equation to convert the image into a new value that describes the tendency of certain phenomena. Furthermore, we will do the testing value of chlorophyll-a concentration using the test method accuracy with RMSE. The results of the research analysis algorithms estimate chlorophyll-a concentrations in the waters of the Kwanyar regency Bangkalan [CHL-a] = - 76.780 + 66.164 Ln (B1) - 50.771 Ln (B2) with the coefficient of correlation and determination (r = 0.591, R = 34, 9%) and RMSE value of 2.374. Algorithm is less accurate results, because the ASTER satellite image sensor does not have a blue band and the decision taken by the field sample data does not match the depth of the waters, so that the mathematical transformation carried out is not appropriate. Key words : image of ASTER, Chlorophyll-a Algorithms estimators, regression method."
Pertanian,35,Manajemen Sumberdaya Perairan,"Keberadaan Mikroplastik Pada Ikan Swanggi (Priacanthus tayenus), Sedimen dan Air Laut di Perairan Pesisir Brondong, Kabupaten Lamongan",Wizarotul Labibah,"Haryo Triajie, S.Pi., M.Si",,"Mikroplastik merupakan sampah plastik yang mengalami degradasi dan terurai menjadi partikel-partikel plastik yang kecil ? 5 mm. Keberadaan mikroplastik di perairan memungkinkan tidak sengaja termakan biota laut seperti ikan. Penelitian ini bertujuan untuk mengetahui bentuk dan jumlah mikroplastik yang terdapat pada saluran pencernaan ikan Swanggi (Priacanthus tayenus), sedimen dan air. Pengambilan sampel diambil 3 kali dengan 1 kali pengambilan sebanyak 9 sampel. Sampel ikan Swanggi yang diidentifikasi dengan melihat jenis kelamin dan ukurannya yaitu ukuran kecil, sedang dan besar dengan panjang 14,9-32 cm dan berat 44-278,5 g untuk ikan Swanggi jantan serta panjang 16,2-26 cm dan berat 56-220 g untuk betina. Hasil menunjukkan bahwa mikroplastik yang ditemukan pada saluran pencernaan ikan Swanggi (Priacathus tayenus), yaitu bentuk fiber, fragmen dan film sebesar 389 partikel/ind untuk ikan Swanggi jantan dan 382 partikel/ind untuk betina. Mikroplastik pada sedimen ditemukan bentuk fiber, fragmen dan film dengan jumlah total 363 partikel/g. Sedangkan mikroplastik pada air ditemukan bentuk fiber, fragmen dan film dengan jumlah total 444 partikel/mL","Microplastic is plastic waste which is degraded and decomposed into small plastic particle ? 5 mm. The presence of microplastics in the waters allows accidentally eaten by marine biota such a fish. This study aims to determine the shape and amount of microplastics found in the digestive tract of Swanggi fish (Priacanthus tayenus), sediment and water. Sampling was taken 3 times with 1 time taking as many as 9 samples. Swanggi fish samples identified by looking at their sex and size are small, medium and large with a length of 14,9-32 cm and weight of 44-278,5 g for male Swanggi fish and a length of 16,2-26 cm and a weight of 56-220 g for females. The result showed that the microplastics found in the digestive tract of swanggi fish (Pricanthus tayenus), namely the form of fiber, fragments and films were 389 particles/ind for Swanggi fish and 382 particles/ind for females. Microplastic in sediments found in the form of fiber, fragments and film with a total of 363 particles/ind. Whereas microplastic in water found in the form of fiber, fragments and films with a total of 444 particles/mL."
Pertanian,35,Manajemen Sumberdaya Perairan,KAJIAN STOK RAJUNGAN (Portunus Pelagicus) DI PENDARATAN IKAN DESA BANCARAN BANGKALAN,Nur Dina Kamelia,"Dr. Firman Farid Muhsoni, S.Pi., M.Sc",,"Rajungan (Portunus pelagicus) merupakan komoditas yang penting karena mempunyai nilai ekonomi tinggi dan permintaan pasar baik di dalam maupun luar negeri masih tinggi. Semakin tingginya permintaan akan rajungan untuk diekspor membuat eksistensi dari rajungan menjadi semakin menurun. Tujuan penelitian ini adalah mengkaji status stok rajungan (Portunus pelagicus) di pendaratan ikan desa Bancaran, Bangkalan yang meliputi laju pertumbuhan, mortalitas, tingkat eskploitasi dan pola rekrutmen. Penelitian ini dilakukan pada bulan Desember 2019-Februari 2020. Sampel rajungan yang ditangkap nelayan setempat menggunakan jaring insang dasar dengan mesh size 3,0-3,5 inci dengan total sampel berjumlah 624 ekor dimana 339 ekor rajungan jantan dan 285 ekor betina. Kisaran lebar karapas 5,24-13,83 cm yang terdiri atas 3 kelompok ukuran dimana secara keseluruhan rajungan di Desa Bancaran, Bangkalan memiliki rata-rata lebar karapas berkisar antara 10,46 cm dengan bobot 76,5 g. Secara umum pola pertumbuhan rajungan jantan, betina, dan gabungan adalah allometrik negatif (?, 0.05) dengan persamaan pertumbuhan Lt = 19,5 [1-e-0,11(t-(-0,5652))]. Laju mortalitas alami (M) rajungan sebesar 0,49 per thaun dan laju mortalitas penangkapan (F) 0,40 per tahun, sehingga diketahui laju eksploitasi rajungan (E) sebesar 45% (under fishing). Pola rekrutmen rajungan di lokasi penelitian tertinggi pada bulan Juni (17,77%).","Blue Swimming Crab (Portunus pelagicus) is an important commodity because it has high economic value and market demand both at home and abroad is still high. The higher demand for crabs for export makes the existence of crabs decrease. The purpose of this study is to assess the status of crab stocks (Portunus pelagicus) in the landing fish of Bancaran village, Bangkalan which includes growth rates, mortality, exploitation rates and recruitment patterns. This research was conducted in December 2019-February 2020. The small crab samples were caught by local fishermen using gill nets with a mesh size of 3.0-3.5 inches with a total sample of 624 in which 339 male crab and 285 females. The range of carapace widths is 5.24-13.83 cm which consists of 3 groups of sizes where as a whole the small crab in Bancaran Village, Bangkalan has an average carapace width ranging from 10.46 cm with a weight of 76.5 g. In general the growth patterns of male, female, and combined crabs are allometric negative (?, 0.05) with a growth equation Lt = 19.5 [1-e-0.11 (t - (- 0.5652))]. The natural mortality rate (M) of the crab is 0.49 per year and the catch mortality rate (F) is 0.40 per year, so that the crab exploitation rate (E) is known to be 45% (under fishing). The cradle recruitment pattern in the research location was the highest in June (17.77%)."
Pertanian,35,Manajemen Sumberdaya Perairan,"ESTIMASI STOK KARBON PADA EKOSISTEM HUTAN MANGROVE DI DESA LEMBUNG PASESER, KECAMATAN SEPULUH, KABUPATEN BANGKALAN",Ahmad Ibrahim,"Dr. Firman Farid Muhsoni, S.Pi. M.Sc",,"Meningkatnya kandungan karbon dioksida (CO2) di udara akan menyebabkan kenaikan suhu bumi karena efek rumah kaca/pemanasan global. Penelitian ini bertujuan untuk mengetahui kerapatan vegetasi jenis tegakan mangrove, total biomassa atas permukaan dan bawah permukaan, mengetahui stok karbon atas permukaan, bawah permukaan dan stok karbon tanah dan mengetahui serapan CO2 atas permukaan, bawah permukaan dan stok karbon tanah pada kawasan hutan mangrove di Desa Lembung Paseser. Pengambilan data stok karbon mengunakan metode non-destruktif sampling yaitu tanpa merusak dengan menggunakan model persamaan allometrik. Penelitian ini dilakukan pada 3 stasiun dan setiap stasiun tardapat 6 plot. Hasil penelitian menunjukkan pada kawasan penelitian ditemukan 9 jenis mangrove yaitu Rhizophora mucronata, Rhizophora stylosa, Rhizophora apiculata, Sonneratia alba, Avicennia marina, Avicennia alba, Ceriop tagal, Ceriop decandra, Aegiceras c. Total kerapatan jenis mangrove pohon sebesar 2.900 ind/ha, pada anakan 206.400 ind/ha dan tingkat semai 3.480.000 ind/ha. Nilai rata-rata kandungan biomassa di atas permukaan sebesar 87,21 ton/ha, bawah permukaan (akar) 36,07 ton/ha. Total rata-rata stok karbon sebesar 231,69 ton/ha, terdiri dari: stok karbon di atas permukaan 40,75 ton/ha, bawah permukaan 16,95 ton/ha dan tanah 173,98 ton/ha. Total rata-rata serapan CO2 mangrove sebesar 849,51 ton/ha, yaitu di atas permukaan 149,44 ton/ha, bawah permukaan 62,15 ton/ha, dan tanah 637,93 ton/ha. Kata kunci: Mangrove, Biomassa, Stok Karbon, Serapan CO2.","The increasing of carbon dioxide (CO2) in the air causes an increase in earth's temperature which occurs due to the greenhouse effect / global warming. This study aims to determine the vegetation density of mangrove stands, total surface and subsurface biomass, determine surface carbon stocks, subsurface and soil carbon stocks and determine CO2 uptake on the surface, subsurface and soil carbon stock in mangrove forest areas in the village. Damp Paseser. Retrieval of carbon stock data using non-destructive sampling method that is without damage by using the allometric equation model. This research was conducted at 3 stations and each station had 6 plots. The results showed that in the study area 9 species of mangrove were found, namely Rhizophora mucronata, Rhizophora stylosa, Rhizophora apiculata, Sonneratia alba, Avicennia marina, Avicennia alba, Ceriop tagal, Ceriop decandra, Aegiceras c. The total density of mangrove tree species is 2,900 ind / ha, in saplings 206,400 ind / ha and seedlings level 3,480,000 ind / ha. The average value of aboveground biomass content is 87.21 tons / ha, subsurface (roots) 36.07 tons / ha. The average total carbon stock of 231.69 tons / ha, consisting of: carbon stocks above the surface of 40.75 tons / ha, subsurface 16.95 tons / ha and land 173.98 tons / ha. The total average mangrove CO2 uptake was 849.51 tons / ha, ie above the surface of 149.44 tons / ha, subsurface 62.15 tons / ha, and land 637.93 tons / ha. Keywords: Mangroves, Biomass, Carbon Stock, CO2 Uptake"
Pertanian,35,Manajemen Sumberdaya Perairan,"Analisis Beban Masuk Nutrien Terhadap Kelimpahan Klorofil-A saat Pagi Hari Di Sungai Bancaran, Kabupaten Bangkalan.",Wahidah Inayati,"Dr. Akhmad Farid, S.Pi.,MT",,"Sungai Bancaran merupakan sungai yang berada di Kabupaten Bangkalan, merupakanperairan yang banyak terdapat aktivitas manusia dan menjadi perairan yang sangat aktif. Kondisi inimempengaruhi kesuburan perairan, khususnya klorofil-a. Konsentrasi klorofil-a di perairan dipengaruhikonsentrasi nutrien dan intensitas cahaya matahari. Penelitian ini bertujuan untuk mengetahuikonsentrasi nutrien, khususnya nitrat dan fosfat, dan pengaruhnya terhadap konsentrasi klorofil-a serta beban masuk nutrien tiap ton/hari di sungai Bancaran. Penelitian dilaksanakan pada bulan Desember 2019 – Januari 2020 di Sungai Bancaran, Kabupaten Bangkalan. Metode yang digunakan adalah metode deskriptif dengan teknik purposive sampling. Stasiun penelitian dibagi 6 stasiun dengan ulangan 3 kali dengan pengambilan sampel air dan kualitas air secara insitu pada pagi hari. Hasil analisis parameter fisika kimia air selama penelitian diperoleh temperatur air (27,97-29,73°C), pH (6,71-7,12), salinitas (1-5 ppt), oksigen terlarut (4,83-6,32mg/l), kecerahan (40,39-81,06cm), nitrat (1,805–1,937 mg/l), fosfat (0,270–0367mg/l). Klorofil-a (0,249–0,377 mg/m3), beban masuk nitrat (0,099-0,247ton/hari), dan beban masuk fosfat (0,019-0,038 ton/hari). Nilai koefisien korelasi (r) nitrat terhadap klorofil-a (0,075 - 0,964) dan fosfat terhadap klorofil-a (0,037 - 0,941).","Bancaran River is a river located in Bangkalan Regency, a water that has a lot of human activity and becomes very active waters. These conditions affect the fertility of the waters, especially chlorophyll-a. The chlorophyll-a concentration in the waters is influenced by the concentration of nutrients and the intensity of sunlight. This study aims to determine the concentration of nutrients, especially nitrates and phosphates, and their effects on the concentration of chlorophyll-a and nutrient entry load per ton / day in the Bancaran river. The study was conducted in December 2019 - January 2020 in the Bancaran River, Bangkalan Regency. The method used is descriptive method with purposive sampling technique. The research station was divided into 6 stations with replications 3 times with water sampling and water quality in situ in the morning. The results of the analysis of the physical chemical parameters of water during the study obtained water temperature (27.97-29.73 ° C), pH (6.71-7.12), salinity (1-5 ppt), dissolved oxygen (4.83-6 , 32mg / l), brightness (40.39-81.06cm), nitrate (1,805-1,937 mg/l), phosphate (0.270-0367 mg/l). Chlorophyll-a (0,249-0,377 mg/m3), nitrate intake load (0.099-0.274 tons/day), and phosphate entry load (0.019-0.038 tons/day). Correlation coefficient (r) nitrate to chlorophyll-a (0.075 - 0.964) and phosphate to chlorophyll-a (0.037 - 0.941)."
Pertanian,37,Magister Pengelolaan Sumber Daya Alam,KARAKTERISASI DAN KOLEKSI PLASMA NUTFAH UNTUK MENCEGAH EROSI GENETIK MELON (Cucumis melo L) LOKAL MADURA,ahmad syaiful umam,"Dr. Ir. Gita Pawana, M.Si","Dr. Ir. Hj. SIti Fatimah, M.Si","Madura merupakan salah satu wilayah pemasok komoditas hortikultura khususnya melon. Namun produktivitas ditingkat petani masih tergolong rendah yang disebabkan tingkat kesuburan lahan yang masih kurang baik, curah hujan rendah serta petani masih menggunakan benih sendiri tanpa adanya seleksi terlebih dahulu. Melon lokal Madura yang berasal dari Kangean memiliki kelebihan rasa yang sangat manis hingga (17% brix). Penelitian ini bertujuan untuk mengetahui hubungan keragaman di antara galur-galur lokal melon madura hasil purifikasi karakter morfologi buah. Metode yang digunakan adalah RAK dengan 3 kali ulangan. Analisis untuk mengetahui hubungan kekerabatan menggunakan metode clustering melalui aplikasi NTSYS 2.1. Karakter kualitatif menghasilkan dendogram dengan koefisien kemiripan 0,77 - 0,97 atau kemiripan 77% - 97% terbagi menjadi 2 (dua) kelompok besar, yaitu kelompok A dan kelompok B. Kelompok A terbagi lagi dalam 2 subkelompok, yaitu subkelompok A1 dan A2. Kemudian subkelompok A1 masih terbagi lagi menjadi 2 kelompok yaitu A1.1 dan A1.2. Kelompok A2 terbagi menjadi 2 kelompok kecil yaitu terdiri dari A2.1 dan A2.2.. Lokal 1 dan 2 memiliki hubungan kekerabatan yang sangat dekat, begitupula dengan lokal 4 dan lokal 6. Kata kunci : Galur Melon, Madura, Hubungan Kekerabatan","Madura is one of the regions supplying horticultural commodities, especially melons. However, the level of productivity of farmers is still relatively low due to the level of land fertility that is still not good, low rainfall and farmers still use their own seeds without prior selection. The local Madura melon from Kangean has a very sweet taste (17% brix) . This study aims to determine the relationship of diversity among local lines of Madura melon resulting from the purification of fruit morphological characters. The method used is RAK with 3 replications. Analysis to determine kinship using the clustering method through the NTSYS 2.1 application. Grouping based on qualitative characters produces a dendogram with a similarity coefficient of 0.77 to 0.97 or a similarity of 77% - 97%. The dendogram also divided 10 melon lines into 3 (three) groups. Group A, there is one strain (Honey Globe strain). While group B is subdivided into 2 large subgroups namely group D (local 1, local 2, local 3 and local 5) and E (Lonnis and Amanta). Group C consists of local lines 4, local 6 and Dainty. Locals 1 and 2 have a very close kinship relationship, as well as local 4 and local 6. Keywords: Melon Strain, Madura, Kinship"
