nama_fakultas,id_prodi,nama_prodi,judul,penulis,pembimbing_pertama,pembimbing_kedua,abstrak,abstrak_inggris
Teknik,9,Teknik Industri,PERUMUSAN STRATEGI BISNIS UD. BUDI JAYA BANGKALAN ?DENGAN PENDEKATAN MODEL FRED R. DAVID,Yulianto Fauzanta,"Fitri Agustina, S.T., M.T","Retno Indriartiningtias, S.T., M.T","Bangkalan merupakan salah satu kabupaten yang memiliki potensi alam salak. ?Potensi alam tersebut dimanfaatkan oleh UD. Budi Jaya yang terletak di Desa ?Kramat? Bangkalan dengan memproduksi produk olahan salak. Selama ini UD ?Budi Jaya menemui banyak kendala, diantaranya adalah mengenai pemasaran, ?produksi bahan baku, dan lain-lain. salah satu solusi kendala tersebut adalah ?dengan merancang strategi bisnis yang sesuai dengan kondisi UD Budi Jaya. ?Model strategi Fred R. David mempunyai tiga tahap yaitu tahap masukan, ?pencocokan dan pengambilan keputusan. Matriks-matriks yang digunakan pada ?penelitian ini adalah IFE (Internal Factor Evaluation), EFE (External Factor ?Evaluation), SWOT, IE (Internal-External) Matrix, GRAND STRATEGY Matrix ?dan QSPM (Quantitative Strategic Planning Matrix). Hasil penelitian ini adalah ?beberapa alternatif strategi diantaranya adalah Strategi 5 (S5) yaitu menciptakan ?produk olahan baru (diversikasi), Strategi 3 (S3) pengiklanan, Strategi 2 (S2) ?Pengembangan produk yaitu meningkatkan kualitas produk, Strategi 7 (S7) ?Melakukan kesepakatan harga dengan anggota kelompok tani yang lain, dan ?strategi 1 (S1) Memperluas pasar.?","Bangkalan is one of the districts that have the potential of natural bark. Natural ?potential use by UD. Budi Jaya is located in the village of Kramat Bangkalan to ?produce refined products barked. During this UD Budi Jaya encountered many ?obstacles, such as the marketing, production materials, and others. one solution to ?the problem is to devise business strategies in accordance with the conditions of UD ?Budi Jaya. Model strategies Fred R. David has three stages: input stage, matching ?and decision making. Matrices used in this study is the IFE (Internal Factor ?Evaluation), EFE (External Factor Evaluation), SWOT, IE (Internal-External) ?Matrix, GRAND STRATEGY Matrix and QSPM (Quantitative Strategic Planning ?Matrix). The results of this study are several alternative strategies such as Strategy 5 ??(S5), was to create a new refined products (diversification), Strategy 3 (S3) ?advertising, Strategy 2 (S2) Product development is to improve the quality of ?products, Strategy 7 (S7 ) Conducting price agreement with the other members of ?farmer groups, and strategies 1 (S1) Expanding markets.?"
Teknik,9,Teknik Industri,USULAN PERBAIKAN UTILITAS RESOURCES PADA LANTAI PRODUKSI PT INDOSPRING TBK DENGAN PENDEKATAN SIMULASI,M Mundir Muhlisin,Mu'alim ST MT,Sugeng Purwoko ST MT,"Simulasi adalah duplikasi atau abstraksi dari persoalan dalam kehidupan nyata ke dalam model matematika. Berdasarkan hasil survey pendahuluan di lantai produksi PT Indospring tbk masih sering terjadi proses produksi yang belum optimal, salah satunya terlihat dari masih adanya jumlah antrian yang cukup tinggi, dan juga target output produksi yang sering belum tercapai. Dengan pendekatan simulasi diharapkan dapat memberikan gambaran permasalahan yang ada pada lantai produksi PT Indospring tbk guna meningkatkan efektifitas dan efisiensi lini produksi dengan cara memperbaiki utilitas pada resources yang ada pada lantai produksi PT Indospring tbk. Berdasarkan hasil pengolahan data didapatkan jumlah antrian tertinggi pada stasiun proses shearing sebesar 610 entity dengan nilai utillitas pada mesin sebesar 88% dan utilitas tenaga kerja sebesar 44%. Setelah usulan perbaikan dilakukan dengan cara menambahkan 1 unit mesin shearing akan berdampak penurunan antrian pada proses shearing dan juga perubahan nilai utilitas pada mesin menjadi 46% dan utilitas tenaga kerja menjadi 46%.","Simulation is a duplication or abstraction of real-life problems into mathematical models. Based on the results of a preliminary survey on the production floor PT Indospring tbk is often not optimal production processes, one of which is visible from the persistence of a relatively high number of queues, as well as production output targets are not achieved. With the simulation approach is expected to provide an overview of existing problems on the production floor PT Indospring tbk to improve the effectiveness and efficiency of production lines by improving the existing utilities in the resources on the production floor PT Indospring tbk. Based on the results of data processing obtained the highest number of queues at the shearing station at 610 entity with the value utility on the engine by 88% and utility workforce by 44%. After the proposed improvements are made by adding 1 unit shearing machine will have an impact on the decline in the queue and the shearing process also changes the value of the utility on the machine to 46% and utility workforce to 46%"
Teknik,10,Teknik Informatika,"PERANCANGAN DAN IMPLEMENTASI SISTEM DATABASE 
TERDISTRIBUSI MENGGUNAKAN ORACLE STUDI KASUS 
SIAKAD UNIVERSITAS TRUNOJOYO",A.Ubaidillah S.Kom,Budi Setyono M.T,Hermawan S.T,"Sistem informasi akademik (SIAKAD) merupakan sistem informasi yang berfungsi menangani pengelolaan dan penyajian data-data akademik, yang oleh pihak fakultas SIAKAD dianggap sangat penting dalam memberikan pelayanan mahasiswa yang membutuhkan informasi akademik. Di Universitas Trunojoyo telah tersedia SIAKAD, namun masih menggunakan database terpusat. Sistem seperti ini memberikan kelebihan yaitu perawatannya mudah selain itu juga membutuhkan sedikit biaya, namun sistem tersebut juga berpotensi mengahadapi kendala-kendala yaitu dalam proses transaksi data karena padatnya jaringan yang menuju database SIAKAD, kelambatan dalam pemrosesan respon query dikarenakan data yang tersimpan semakin besar dan pemrosesan semakin kompleks, dan juga memiliki kelemahan dalam hal ketersediaan data. Untuk itu sistem seperti ini memerlukan pengembangan sistem database yang lebih baik dengan menggunakan sistem databases terdistribusi pada masing-masing fakultas yang dapat dijadikan solusi bagi permasalahan di atas. Karena dalam basisdata terdistribusi terdapat keuntungan yang tidak dimiliki oleh basisdata terpusat yaitu pengawasan distribusi, reability, availability, kecepatan dalam pemrosesan query dan otonomi local","Academic information systems (SIAKAD) is an information system that functions to handle the management and presentation of academic data, which by the faculty SIAKAD considered very important in providing students who need academic information. At the SIAKAD of Trunojoyo University available, but still uses a centralized database. Such systems provide the advantage of easy maintenance but it also requires a small fee, but the system also has the potential to confront the obstacles in the process of transaction data due to network congestion SIAKAD database, delays in processing the query response since the larger the stored data and processing increasingly complex, and also has a disadvantage in terms of data availability. For that such systems require the development of a better database system using a system of distributed databases in each faculty that can be used as a solution to the problems above. Because there are advantages in a distributed database that is not owned by a centralized database that is surveillance of distribution, reability, availability, speed query processing and local autonomy"
Teknik,10,Teknik Informatika,APLIKASI KONTROL DAN MONITORING JARINGAN KOMPUTER BERBASIS MOBILE,"M. Basith Ardianto,","Drs. Budi Soesilo, MT","Koko Joni, ST","Berjalannya koneksi jaringan komputer dengan lancar dan tanpa gangguan merupakan harapan seluruh penggunanya, terutama pihak yang bertanggung jawab pada bidang itu, yakni administrator jaringan. Namun tidak selamanya koneksi jaringan dapat berjalan dengan lancar tanpa adanya gangguan. Kenyataan di lapangan terutama pada jaringan komputer skala besar, berpotensi besar terjadi gangguan atau bahkan kerusakan koneksi jaringan komputer. Hal ini rata - rata disebabkan banyaknya penggunaan serta padatnya traffic data dalam jaringan komputer itu sendiri. Oleh karena itu untuk menjaga bahkan meningkatkan kualitas layanan koneksi jaringan maka diperlukan adanya akses kontrol dan monitoring pada level administrator jaringan secara real-time berbasis mobile, yang dapat mengatur dan mengetahui informasi tentang koneksi jaringan dan dapat diakses setiap saat. Pihak administrator jaringan dituntut untuk terlebih dahulu mengetahui adanya gangguan atau bahkan terputusnya koneksi jaringan walaupun administrator tidak berada di tempat kontrol dan monitoring, Dengan adanya sistem kontrol dan monitoring berbasis mobile, diharapkan dapat membantu tugas administrator dalam mengontrol dan memantau jaringan serta dalam mengambil kebijakan atas node – node yang terkoneksi pada jaringan yakni memanajemen koneksi, port dan bandwidth setiap saat dan secara mobile. agar dengan segera dapat melakukan pembenahan ketika terjadi gangguan jaringan sebelum pemakai jaringan (klien) melakukan pengaduan atas adanya gangguan. Kata Kunci : Administrator Jaringan, Koneksi Jaringan, Akses Kontrol dan Monitoring.",-
Teknik,10,Teknik Informatika,"RANCANG BANGUN APLIKASI PROXY SERVER UNTUK
ENKRIPSI KODE HTML MENGGUNAKAN
ALGORITMA BLOWFISH","Akhmad Suyandi, S.Kom","Drs. Budi Soesilo, M.T","Hermawan, ST, MT","Web server adalah sebuah perangkat lunak server yang berfungsi menerima permintaan HTTP atau HTTPS dari web client dan mengirimkan jawaban dalam bentuk halaman-halaman web yang umumnya berbentuk dokumen HTML. Dokumen HTML yang dikirim merupakan dokumen yang dibentuk dari bahasa markup yang plaintext. Artinya, dokumen berisi kode-kode HTML murni tanpa proses enkripsi. Tujuan dari penelitan ini adalah membuat sebuah aplikasi proxy server yang menerima permintaan HTTP dari web client dan meneruskannya ke web server. Kemudian aplikasi ini akan menerima respon dari server dan melakukan proses enkripsi pada dokumen HTML terlebih dahulu. Sehingga dokumen HTML yang dikirim kepada web client sudah berbentuk dokumen HTML yang terenkripsi. Web client disini bisa berupa aplikasi seperti Internet Explorer, Mozilla Firefox, atau Opera. Aplikasi-aplikasi tersebut biasa dikenal dengan sebutan web browser. Ketika web browser menerima dokumen HTML yang terenkripsi dari aplikasi proxy server, maka JavaScript Engine yang ada di web browser akan melakukan proses dekripsi sekaligus rendering sehingga dokumen akan ditampilkan sesuai dengan aslinya. Namun apabila kode dari dokumen HTML tersebut dilihat melalui menu view source yang ada di web browser akan didapatkan dokumen HTML yang tetap terenkripsi.","Web server is a server software functioning to receive HTTP or HTTPS requests from web clients and send the answer in a form of web pages which are commonly in HTML documents. The sent HTML documents are documents created from plaintext markup language; that are documents consisting of pure HTML codes without encryption process. This study aims to create a proxy server application receiving HTTP requests from web clients and sending them to the web servers. Then, the requests will be received by the application through the server to be encrypted. So, the HTML documents sent to the web clients are encrypted HTML documents. The web clients used here could be applications such as Internet Explorer, Mozilla Firefox, or Opera. The applications are commonly termed web browsers. As the web browsers receive the encrypted HTML documents from the proxy server application, JavaScript Engines in the web browsers will decrypt and render the documents so they appear as the original. However, if the HTML document codes are viewed through view source menu in the web browser, the HTML documents will still be encrypted."
Teknik,10,Teknik Informatika,"SISTEM PENDUKUNG KEPUTUSAN OPTIMASI PENJADWALAN MATAKULIAH UNTUK PENGGUNAAN RUANGAN KULIAH BERSAMA DI UNIVERSITAS TRUNOJOYO MADURA MENGGUNAKAN ALGORITMA  
GENETIKA",Heri Supriyanto,"Mulaab, S.Si., M.Kom","Firli Irhamni, ST., M.Kom","Penjadwalan kuliah di Perguruan Tinggi merupakan masalah yang kompleks. Dalam permasalahan tersebut terdapat beberapa variabel yang harus dipertimbangkan supaya mendapatkan jadwal yang optimal. Di dalam penyusunan jadwal kuliah ini terdapat sangat banyak kemungkinan yang selayaknya dicoba untuk menemukan penjadwalan yang terbaik. Karena itu dibutuhkan metode optimasi yang dapat diterapkan untuk mengerjakan penjadwalan mata kuliah ini. Metode yang dapat digunakan untuk menyelesaikan permasalahan tersebut adalah dengan menggunakan Algoritma Genetika. Tugas Akhir ini bertujuan untuk membuat suatu sistem yang dapat membuat jadwal matakuliah secara otomatis dan hasilnya optimal. Dari hasil penelitian yang dilakukan algoritma genetika mampu membuat jadwal dengan optimal yang dibuktikan dari nilai fitness yang memiliki nilai 1 secara otomatis jadwal yang dibentuk akan optimal. Semoga adanya aplikasi ini diharapkan bisa mempermudah didalam pembuatan penjadwalan matakuliah dengan mudah dan cepat. Kata Kunci: Algoritma Genetika, Optimasi, Penjadwalan.","Scheduling courses in universities is a complex issue. In these problems there are several variables that must be considered in order to obtain an optimal schedule. In the preparation of class schedules, there are so many possibilities that should be tried to find the best scheduling. Therefore required optimization methods that can be applied to work on scheduling this course. The method can be used to solve these problems is to use a Genetic Algorithm. Final Project aims to create a system that can automatically create a course schedule and the results are optimal. From the results of research on the genetic algorithm is able to make a schedule with a proven optimal fitness value has a value of 1 is automatically set up a schedule that would be optimal. Hopefully this application is expected to ease in making scheduling easy and fast course. Keywords: Genetic Algorithms, Optimization, Scheduling."
Teknik,11,Manajemen Informatika,SISTEM INFORMASI PERUSAHAAN OTOBUS SUMBER KENCONO BERBASIS  WEB,Elky Lilik Misdayani,"Fitri Damayanti,S.Kom,M.Kom",,"Sistem informasi pengolahan data yang dibutuhkan oleh sebuah organisasi dipergunakan untuk tujuan pengumpulan, pengolahan, penyimpanan dan melihat kembali data itu sendiri. Dengan menggunakan Sistem Informasi Perusahaan Otobus Sumber Kencono proses pencatatan yang dilakukan oleh masing – masing petugas dengan sesuai kebutuhan dapat di selesaikan dengan lebih cepat, tepat dan lengkap dengan hasil akhir yang dapat menginputkan data kerusakan bus, penginputan gaji crew, jadwal keberangkatan bus, informasi lerling crew serta tarif yang diberlakukan oleh perusahaan untuk pengguna jasa (pelanggan) untuk diproses menjadi sebuah laporan. Sistem Informasi ini dapat menangani masalah yang ada pada perusahaan dengan lebih cepat. Sistem ini akan memberikan informasi yang cepat dan akurat kepada pegawai bengkel bus ada tidaknya bus yang perlu segera ditangani, kasir juga dengan mudah dalam menghitung gaji crew sesuai dengan pendapatan yang diperoleh serta inputan data keberangkatan bus, operasional tidak akan kerepotan dalam menentukan diterima atau tidaknya crew baru dan semua pengguna pelanggan bus dapat mengetahui tarif penumpang tanpa adanya manipulasi.","Data processing information systems needed by an organization used for the purpose of collecting, processing, storing and reviewing at the data itself. By using the Otobus Company Sumber Kencono Information System Resources recording process performed by each officer needs to be resolved more quickly, precisely and completely with the end result of damage that has an ability to input data bus, inputting payroll crew, bus departures, information lerling crew as well as the tariffs imposed by the company to service users (customers) to be processed into a report. This information system can handle the problems that exist in companies with more quickly. This system will provide fast and accurate information to the bus garage employees whether or not there buses that need to be addressed, the cashier also easily calculate the salary of the crew in accordance with the revenue generated and the data input bus departure, will not be operational hassles in determining the admissibility of crew new customers and all users can know the bus fare passengers without any manipulation."
Teknik,11,Manajemen Informatika,"SISTEM INFORMASI GEOGRAFIS PEMETAAN POTENSI OBJEK WISATA DI
KABUPATEN SUMENEP BERBASIS DEKSTOP DAN WEB",lu'luul maknun,"Aeri Rahmad,S.T,M.T",-,"Abstrak Perkembangan teknologi di berbagai bidang sangat terasa perkembangannya, begitu juga dengan bidang pariwisata. Kebutuhan informasi yang cepat dan mudah didapatkan oleh masyarakat di berbagai bidang juga sangat terasa sekali peningkatannya, tidak terkecuali kebutuhan informasi di bidang pariwisata. Peta konvensional seringkali menyulitkan pengguna karena kurang menyajikan informasi secara spesifik dan diperlukan ketelitian agar dapat menemukan jalan dan tempat yang akan dituju. Program sistem informasi geografis tempat wisata di kabupaten sumenep berbasiskan web adalah sebuah sistem informasi yang bertujuan untuk membantu para pengunjung dan wisatawan untuk dapat mengetahui rute, letak, dan informasi tempat wisata dan tempat pendukung lainnya di kabupaten sumenep sehingga dapat mempersingkat waktu pencarian. Sistem informasi geografis tempat wisata di kabupaten sumenep berbasiskan dekstop dan web ini memiliki beberapa kelebihan, yaitu dapat diakses dimana saja dan kapan saja selama ada akses internet, dan penyampaian informasi jelas karena dilengkapi dengan map atau peta dan rute Kata Kunci: SIG, Pemetaan, Potensi Objek Wisata, Arcview","Abstract Data processing systems required by an institution or organization to function for the purpose of collecting, storing and view the data itself. Using Information System data collection process marriage, pilgrimage, endowments in the area Socah will be completed more quickly and accurately by including a complete data and processed into monthly reports to KUA itself. Information Systems Office of Religious Affairs Socah Bangkalan can handle weddings letter, letter of reference and manipulation of data relating to such household data widower, widow of data, data that married people get out and into the area as well as data princes who marry the bride. To divorce, KUA only registers record number of Religious Court decision letter. In addition, this Information System can store and process data into a Endowments Hajj and information. Keywords: Marriage, Divorce, Reconciliation, Information Systems, Hajj, Endowments."
Teknik,11,Manajemen Informatika,SISTEM INFORMASI PSIKOTES BERBASIS DEKSTOP,Megawati Bukhori Putri,"Yeni Kustianingsih, S.Kom, M.Kom",-,"Abstrak Perkembangan teknologi di berbagai bidang sangat terasa perkembangannya. Kebutuhan informasi yang cepat dan mudah didapatkan oleh masyarakat di berbagai bidang juga sangat terasa sekali peningkatannya, tidak terkecuali kebutuhan informasi di bidang potensi diri. Untuk mengatasi masalah tersebut, dibuatlah program psikotes yang memungkinkan peserta tes melakukan tes secara terkomputerisasi. Program ini dapat menginputkan soal yang bertipe satuan, pilihan ganda, dan soal cerita. Psikotes berbasiskan web adalah sebuah sistem informasi yang bertujuan untuk membantu para pengguna melakukan tes yang telah terkomputerisasi. Sistem informasi psikotes berbasiskan web ini memiliki beberapa kelebihan, yaitu dapat diakses dimana saja dan kapan saja selama ada akses internet, dan penyampaian informasi jelas. Psikotes dilakukan untuk mengukur tingkat inteligensi, mental seseorang, menyelidiki dan menetapkan sifat-sifat psikis. Sukses tidaknya dalam menyelesaikan tes psikotes tergantung sejauh mana kita dapat menyelesaikan masalah-masalah yang diberikan secara cepat dan akurat. Dengan perkembangan teknologi informasi yang begitu pesat disegala bidang khususnya perusahaan, institusi pendidikan maupun organisasi, maka penelitian ini dibahas tentang pengembangan sistem tes psikotes. Dari pengembangan sistem yang dibuat, dapat diambil kesimpulan bahwa sistem tes psikotes dengan menggunakan internet serta hasil tes psikotes dapat diproses langsung sehingga pengguna dapat melihat secara langsung hasil tes psikotes tesebut, sehingga hal ini sangat efektif dan efisien bagi pengguna Kata Kunci: Tes Psikotes, Terkomputerisasi","Abstract Technological developments in various fields is very pronounced development. The need for information quickly and easily accessible by the public in various fields also are felt at improvement, not least in the field of information needs potential. To overcome these problems, made psychological program that allows participants to test a computerized test. This program can menginputkan about the type of unit, multiple choice, and about the story. Psycho is a web-based information system that aims to help users perform tests have been computerized. Web-based information systems psycho has several advantages, which can be accessed anywhere and anytime as long as there is internet access, and delivery of information clearly. Psychological test done to measure the level of intelligence, mental, investigate and define the properties of the psychic. Success or failure in completing psychological tests depends on the extent to which we can solve the given problems quickly and accurately. With the development of information technology so rapidly in all fields, especially companies, educational institutions and organizations, the research discussed psychological test system development. From the development of the system is created, it can be concluded that the psychological test system by using the internet and the results of psychological tests can be processed immediately so that the user can directly see the results of psychological tests proficiency level, so it is very effective and efficient for the user. Keywords: Psycho Test, Computerized"
Teknik,11,Manajemen Informatika,Perancangan Dan Pembuatan Sistem Informasi Manajemen Data Dana Keuangan Di SMA PGRI 2 BANGKALAN Berbasis SMS Gateway,Andika Syarifuddin Parmana Putra,"Sri Herawati,S.Kom","Sri Herawati,S.Kom","Abstrak Sistem Informasi Manajemen Data Dana Keuangan Berbasis SMS Gateway adalah suatu sistem sistem informasi yang menyediakan mekanisme untuk menghantar dan menerima SMS dari peralatan mobile (HP, PDA phone, dll). Dalam sistem ini akan dibahas beberapa pokok penting diantaranya, pengolahan data dana keuangan administrasi, pengelolahan dana keuangan BP3, pengelolahan distribusi dana gaji guru/pegawai. Sistem ini akan menggunakan tekhnologi sms gateway yang mana sangat banyak diminati dan digunakan oleh banyak kalangan masyarakat. Selain karena unggul dari segi kepraktisan dan kemudahan dalam penggunaannya, teknologi ini juga hadir dengan tarif yang relatif lebih murah, lebih efisien serta inovatif media pengiriman data pesan atau transfer informasi dalam kapasitas kecil apabila dibandingkan dengan layanan suara. Tujuan dari sistem ini adalah bagaimana memanajemen keuangan dengan baik dan cepat cara penyampaian informasi kepada user/pegawai yang membutuhkan. Kata Kunci : Sistem Pengelolaan Data Dana Keuangan,Sistem Informasi","Abstract Data Management Information System Treasury Fund Based SMS Gateway is a system of information system that provides a mechanism to deliver and receive SMS from mobile devices (HP, PDA phone, etc.). In these systems will be discussed some important points, among others, financial data processing fund administration, financial funds pengelolahan BP3, pengelolahan distribution fund teacher salaries / employee. This system will use sms gateway technology which is very much in demand and used by many people. In addition to its superior in terms of practicality and ease of use, this technology also comes with a relatively cheaper rates, more efficient and innovative data transmission media messages or information transfer in a small capacity compared to voice services. The purpose of this system is how to manage finances well and fast way to deliver information to the user / employee in need. Key words : Fund Financial Data Management Systems, Information Systems"
